Automação e Mecatrônica;2023;Uso de ferramentas de automação de arquitetura aberta;Automação arquitetura aberta;Até 10% do mercado;0;10;31 a 50% do mercado;31;50;51 a 70% do mercado;51;70;;;;;;;;;;;;;;;Técnico em Automação Industrial;;;;;;Reconhecimento de padrões;;Visualização;;;Tolerância ao estresse;26, 27, 28;;;
Automação e Mecatrônica;2023;;;;0;0;;0;0;;0;0;;;;;;;;;;;;;;;Técnico em Mecatrônica;Trabalhar com dados, informática, banco de dados, integrados com o conhecimento de mecânica que ele já tem;;Computadores, Eletrônica e automação;;;Aprendizagem ativa;;Ordenação de informações;;;Adaptabilidade / Flexibilidade;26, 27, 28;;;
Automação e Mecatrônica;2023;;;;0;0;;0;0;;0;0;;;;;;;;;;;;;;;Técnico em Mecatrônica;Implantar e manter as novas tecnologias indicadas pelo tecnólogo ou engenheiro;;Ciência da computação;;;Compreensão de leitura;;Reconhecimento de voz;;;Cooperação;26, 27, 28;;;
Automação e Mecatrônica;2023;;;;0;0;;0;0;;0;0;;;;;;;;;;;;;;;Técnico em Mecatrônica;;;;;;Pensamento crítico;;Controle e precisão;;;Pensamento analítico;26, 27, 28;;;
Automação e Mecatrônica;2023;;;;0;0;;0;0;;0;0;;;;;;;;;;;;;;;Robotista ou Operador de Sistemas robóticos;Modelar e programar o funcionamento do robô;;Computadores, Eletrônica e automação;;;Aprendizagem ativa;;Atenção seletiva;;;Atenção aos detalhes;26, 27, 28;;;
Automação e Mecatrônica;2023;;;;0;0;;0;0;;0;0;;;;;;;;;;;;;;;Robotista ou Operador de Sistemas robóticos;Desenvolver soluções para que o uso do robô atenda requisitos de segurança do processo produtivo;;Ciência da computação;;;Matemática;;Memorização;;;Autocontrole;26, 27, 28;;;
Automação e Mecatrônica;2023;;;;0;0;;0;0;;0;0;;;;;;;;;;;;;;;Robotista ou Operador de Sistemas robóticos;Integrar o robô no sistema produtivo, de acordo com as atividades que ele vai realizar autonomamente ou em colaboração com humanos;;Legislação e Governo;;;Pensamento crítico;;Multitarefa;;;Inovação;26, 27, 28;;;
Automação e Mecatrônica;2023;;;;0;0;;0;0;;0;0;;;;;;;;;;;;;;;Robotista ou Operador de Sistemas robóticos;Garantir que as informações das atividades do robô possam ser coletadas via sistema;;;;;Resolução de problemas complexos;;Ordenação de informações;;;Pensamento analítico;26, 27, 28;;;
Automação e Mecatrônica;2023;;;;0;0;;0;0;;0;0;;;;;;;;;;;;;;;Robotista ou Operador de Sistemas robóticos;;;;;;Instalação;;Percepção de problemas;;;Cooperação;26, 27, 28;;;
Automação e Mecatrônica;2023;;;;0;0;;0;0;;0;0;;;;;;;;;;;;;;;Técnico em Instrumentação Industrial;Coletar e analisar dados, manipular bancos de dados obtidos das máquinas;;Ciência da computação;;;Pensamento crítico;;Flexibilidade para categorização;;;Cooperação;26, 27, 28;;;
Automação e Mecatrônica;2023;;;;0;0;;0;0;;0;0;;;;;;;;;;;;;;;Técnico em Instrumentação Industrial;Trabalhar com sensores para monitoramento;;;;;Resolução de problemas complexos;;Fluência de ideias;;;Inovação;26, 27, 28;;;
Automotivo;2019;Sistemas automatizados/informatizados para realização de diagnósticos;Diagnósticos automatizados;11 a 30% do mercado;11;30;31 a 50% do mercado;31;50;;0;0;;;;0;;0;;;;0;;0;;;Técnico em Conectividade Veicular;Aplicar procedimentos de segurança dos sistemas;;Engenharia e Tecnologias;;;Matemática;;;;;Autocontrole;29;;;
Automotivo;2019;Recursos virtuais para realizar o diagnóstico/manutenção.;Recursos virtuais;31 a 50% do mercado;31;50;51 a 70% do mercado;51;70;;0;0;;;;0;;0;;;;0;;0;;;Técnico em Conectividade Veicular;Diagnosticar controles interativos;;Física;;;Compreensão de leitura;;;;;Atenção aos detalhes;29;;;
Automotivo;2019;Processos de colagem em partes sensíveis do veículo em substituição aos processos tradicionais de soldagem;Colagem veicular;31 a 50% do mercado;31;50;51 a 70% do mercado;51;70;;0;0;;;;0;;0;;;;0;;0;;;Técnico em Conectividade Veicular;Configurar periféricos internos externos;;Mecânica;;;Comunicação;;;;;Autocontrole;29;;;
Automotivo;2019;Diagnóstico com técnico/suporte online;Suporte online;Até 10% do mercado;0;10;11 a 30% do mercado;11;30;;0;0;;;;0;;0;;;;0;;0;;;Técnico em Conectividade Veicular;Realizar operações com as células de energia;;Ciência da computação;;;Programação;;;;;Iniciativa;29;;;
Automotivo;2023;;;;0;0;;0;0;;0;0;;;;;;;;;;;;;;;Tecnólogo em sistemas automotivos;Realizar medição e leitura de instrumentos eletromecânicos;;Língua Estrangeira;;;Pensamento crítico;;Ordenação de informações;;;Consciência ambiental;29;;;
Automotivo;2023;;;;0;0;;0;0;;0;0;;;;;;;;;;;;;;;Tecnólogo em sistemas automotivos;Identificar e consertar falhas nos sistemas eletrônicos e nos componentes do veículo;;Mecânica;;;Negociação;;Percepção de problemas;;;Iniciativa;29;;;
Automotivo;2023;;;;0;0;;0;0;;0;0;;;;;;;;;;;;;;;Tecnólogo em sistemas automotivos;Montar, desmontar e trocar componentes eletrônicos no veículo;;Legislação e Governo;;;Julgamento e tomada de decisões;;Velocidade perceptiva;;;Inovação;29;;;
Automotivo;2023;;;;0;0;;0;0;;0;0;;;;;;;;;;;;;;;Tecnólogo em sistemas automotivos;Acessar sistemas e utilizar a rede CAN;;Vendas e Marketing;;;Gestão de recursos de pessoal;;Visualização;;;Pensamento analítico;29;;;
Automotivo;2023;;;;0;0;;0;0;;0;0;;;;;;;;;;;;;;;Tecnólogo em sistemas automotivos;Seguir os novos padrões de qualidade e segurança em sistemas automotivos;;;;;Gestão do tempo;;Controle e precisão;;;Persistência;29;;;
Automotivo;2023;;;;0;0;;0;0;;0;0;;;;;;;;;;;;;;;Tecnólogo em sistemas automotivos;Desenvolver soluções em sistemas automotivos;;;;;Resolução de problemas complexos;;Destreza dos dedos;;;Tolerância ao estresse;29;;;
Automotivo;2023;;;;0;0;;0;0;;0;0;;;;;;;;;;;;;;;Mecânico de veículos leves;Fazer diagnóstico de falhas usando equipamentos eletrônicos de análise e identificação de falhas;;Computadores, Eletrônica e automação;;;Aprendizagem ativa;;Multitarefa;;;Adaptabilidade / Flexibilidade;29;;;
Automotivo;2023;;;;0;0;;0;0;;0;0;;;;;;;;;;;;;;;Mecânico de veículos leves;Inspecionar e reparar veículos híbridos e elétricos;;Ciência da computação;;;Instrução;;Controle e precisão;;;Cooperação;29;;;
Automotivo;2023;;;;0;0;;0;0;;0;0;;;;;;;;;;;;;;;Mecânico de veículos leves;Estimar os custos de reparo do veículo;;Mecânica;;;Negociação;;Sensibilidade auditiva;;;Inovação;29;;;
Automotivo;2023;;;;0;0;;0;0;;0;0;;;;;;;;;;;;;;;Mecânico de veículos leves;Reparar caixas de transmissão automática;;;;;Resolução de problemas complexos;;Destreza manual;;;Liderança;29;;;
Automotivo;2023;;;;0;0;;0;0;;0;0;;;;;;;;;;;;;;;Mecânico de veículos leves;Realizar manutenção de veículos híbridos e elétricos;;;;;Manutenção de equipamentos;;Percepção de problemas;;;Pensamento analítico;29;;;
Automotivo;2023;;;;0;0;;0;0;;0;0;;;;;;;;;;;;;;;Mecânico de veículos leves;Realizar testes nos componentes eletrônicos do computadorr de bordo para garantir a operação adequada;;;;;Projetos tecnológicos;;Compreensão escrita;;;Orientação a resultados;29;;;
Automotivo;2023;;;;0;0;;0;0;;0;0;;;;;;;;;;;;;;;Mecânico de veículos leves;;;;;;Avaliação de sistemas;;Raciocínio numérico;;;Tolerância ao estresse;29;;;
Automotivo;2023;;;;0;0;;0;0;;0;0;;;;;;;;;;;;;;;Tecnólogo em sistemas automotivos;Realizar diagnóstico através da telemetria: medição e leitura de unidades eletrônicas em automóvel;;Computadores, Eletrônica e automação;;;Compreensão de leitura;;Compreensão escrita;;;Adaptabilidade / Flexibilidade;29;;;
Energia (GTD);2022;;;;0;0;;0;0;;0;0;;;;;;;;;;;;;;;Eletricista de Redes de Distribuição;Interpretar lógicas de programação de equipamentos (baixa complexidade);;Computadores, Eletrônica e automação;;;Aprendizagem ativa;;Raciocínio indutivo;;;Autocontrole;35;351;;
Energias Renováveis;2018;Uso de tecnologia de células fotovoltaicas de maior eficiência e menor custo;Células fotovoltaicas;Não ocorrerá difusão;0;0;Até 10% do mercado;0;10;;0;0;;;;0;;0;;;;0;;0;;;Reparador de pás de aerogeradores;;;Transportes;;;Seleção de equipamentos;;;;;Tolerância ao estresse;35;;;
Energias Renováveis;2018;Implantação de ferramentas e métodos de engenharia de confiabilidade/manutenção;Engenharia confiabilidade;Até 10% do mercado;0;10;11 a 30% do mercado;11;30;;0;0;;;;0;;0;;;;0;;0;;;Técnico em energias renováveis;Planejar a manutenção preventiva, preditiva e corretiva dos sistemas de energias renováveis.;;Engenharia e Tecnologias;;;Instalação;;;;;Confiabilidade;35;;;
Mineração;2020;Uso, pelas empresas de mineração, de modelagem 3D para criação de diagramas de áreas subterrâneas como parte do trabalho de exploração antes da construção de novas minas.;Modelagem 3D;;0;0;;0;0;;0;0;;;;0;;0;;;;0;;0;;;Operador de Usina;Avaliar economicamente o rendimento da planta;;;;;Monitoramento de operações;;;;;Liderança;07, 08;;;
Mineração;2020;Uso, pelas empresas de mineração, de sistemas de armazenamento em nuvem (Cloud) para armazenamento de dados e coordenação de operações.;Armazenamento nuvem;;0;0;;0;0;;0;0;;;;0;;0;;;;0;;0;;;Especialista em tecnologias digitais para mineração;Realizar modelos tridimensionais de ambientes de mineração;;Administrativos;;;Análise de operações;;;;;Adaptabilidade / Flexibilidade;07, 08;;;
Mineração;2020;Uso, pelas empresas de mineração, de sistemas de Big Data e Data Mining, para coleta e processamento de grandes quantidades de dados para otimização da produção e auxílio nas relações do setor com as partes interessadas.;Big data;;0;0;;0;0;;0;0;;;;0;;0;;;;0;;0;;;Especialista em tecnologias digitais para mineração;Alimentar e validar banco de dados na nuvem;;Ciência da computação;;;Análise de controle de qualidade;;;;;Confiabilidade;07, 08;;;
Mineração;2020;Uso, pelas empresas de mineração, de novas tecnologias para extração e processamento em áreas de fronteira onde a extração não era economicamente viável anteriormente.;Tecnologias fronteira;;0;0;;0;0;;0;0;;;;0;;0;;;;0;;0;;;Especialista em tecnologias digitais para mineração;Executar melhorias propostas pelos modelos de gestão;;Transportes;;;Aprendizagem ativa;;;;;Cooperação;07, 08;;;
Mineração;2020;Uso, pelas empresas de mineração, de ferramentas integradas de gestão.;Gestão integrada;;0;0;;0;0;;0;0;;;;0;;0;;;;0;;0;;;Especialista em tecnologias digitais para mineração;Analisar dados via Drones relativos à mineração para apoio ao planejamento da produção;;Engenharia e Tecnologias;;;Avaliação de sistemas;;;;;Autocontrole;07, 08;;;
Mineração;2020;Implantação, nas empresas de mineração, de ferramentas para o processo de tomada de decisão baseadas no monitoramento da concorrência (tecnológico ou de mercado).;Monitoramento concorrência;;0;0;;0;0;;0;0;;;;0;;0;;;;0;;0;;;Especialista em tecnologias digitais para mineração;Avaliar resultados dos sistemas de despacho para conseguir tomar decisões de melhorias e verificar possíveis falhas;;Filosofia e Teologia;;;Ciências;;;;;Iniciativa;07, 08;;;
Mineração;2020;Uso, pelas empresas de mineração, de tecnologias para redução de desperdícios.;Redução desperdícios;;0;0;;0;0;;0;0;;;;0;;0;;;;0;;0;;;Operador de Mina;Realizar operação de veículos autônomos;;Ciência da computação;;;Análise de operações;;;;;Atenção aos detalhes;07, 08;;;
Mineração;2020;Uso, pelas empresas de mineração, de modelagem 3D para criação de diagramas de áreas subterrâneas como parte do trabalho de exploração antes da construção de novas minas.;Modelagem 3D;;0;0;;0;0;;0;0;;;;0;;0;;;;0;;0;;;Operador de Mina;Avaliar, por meio de procedimentos estabelecidos, a segurança da área de trabalho;;Produção e Processamento;;;Aprendizagem ativa;;;;;Confiabilidade;07, 08;;;
Mineração;2020;Uso, pelas empresas de mineração, de drones para mapeamento e coleta de informações.;Drones;;0;0;;0;0;;0;0;;;;0;;0;;;;0;;0;;;Operador de Mina;Garantir a produtividade, por meio de indicadores de desempenho, programada para a atividade;;Legislação e Governo;;;Gestão do tempo;;;;;Cooperação;07, 08;;;
Mineração;2020;Uso, pelas empresas de mineração de tecnologias de ciber segurança, para proteção de dados;Cibersegurança;;0;0;;0;0;;0;0;;;;0;;0;;;;0;;0;;;Operador de Mina;Manter o equipamento em perfeito estado de uso, por meio de ações de manutenção;;Matemática;;;Negociação;;Fluência de ideias;;;Inovação;07, 08;;;
Mineração;2020;Uso, pelas empresas de mineração, de sistemas e equipamentos automatizados na linha de produção, e nas áreas administrativas.;Automação;;0;0;;0;0;;0;0;;;;0;;0;;;;0;;0;;;Operador de Mina;Utilizar informações digitais de maneira eficiente, eficiente e ética.;;Pessoal e Recursos Humanos;;;Orientação a serviços;;;;;Iniciativa;07, 08;;;
Mineração;2020;Uso, pelas empresas de mineração, de sistemas de armazenamento em nuvem (Cloud) para armazenamento de dados e coordenação de operações.;Armazenamento nuvem;;0;0;;0;0;;0;0;;;;0;;0;;;;0;;0;;;Operador de Mina;Disseminar informações, bem como desenvolver ações e projetos por meio de redes;;Pessoal e Recursos Humanos;;;Programação;;;;;Liderança;07, 08;;;
Mineração;2020;Estabelecimento, nas empresas de mineração, de indicadores de desempenho mensurados por ferramentas de TI.;Indicadores de desempenho;;0;0;;0;0;;0;0;;;;0;;0;;;;0;;0;;;Operador de Usina;Analisar dados de processos de beneficiamento de minério;;Matemática;;;Análise de controle de qualidade;;;;;Adaptabilidade / Flexibilidade;07, 08;;;
Mineração;2020;Uso, pelas empresas de mineração, de veículos autônomos, em determinadas operações.;Veículos autônomos;;0;0;;0;0;;0;0;;;;0;;0;;;;0;;0;;;Operador de Usina;Monitorar o consumo de energia, de insumos e de manutenção na planta;;Produção e Processamento;;;Percepção social;;Flexibilidade para categorização;;;Inovação;07, 08;;;
Refrigeração e Climatização;2022;Crescimento do uso de termostatos inteligentes (ex. que utilizam o refrigerante 410A) para redução do consumo de energia e otimização da forma como  são operados os sistemas prediais de climatização (reduzindo a possibilidade de deixar o ar-condicionado ligado por muito tempo e quando não é necessário usar) . ;Termostatos inteligentes;;0;0;;0;0;;0;0;;;;;;;;;;;;;;;Mecânico de Refrigeração e Climatização Residencial;Operar sistemas de forma remota;;Administração e Gestão;;;Compreensão de leitura;;Expressão escrita;;;Atenção aos detalhes;28, 33, 43;282, 331, 432;28232, 28241, 33147, 43223;3314707, 4322302
Refrigeração e Climatização;2022;Crescimento do monitoramento remoto objetivando manter os processos de manutenção de forma regular e proativa, resultando no prolongamento da vida útil dos sistemas de HVAC e redução dos custos. ;Monitoramento remoto;;0;0;;0;0;;0;0;;;;;;;;;;;;;;;Mecânico de Refrigeração e Climatização Residencial;Realizar manutenções em Sistemas VRF/VRC;;Comunicações e Mídia;;;Instrução;;Percepção de problemas;;;Inovação;28, 33, 43;282, 331, 432;28232, 28241, 33147, 43223;3314707, 4322302
Refrigeração e Climatização;2022;Crescimento dos processos de integração entre os termostatos inteligentes com os serviços de monitoramento, bem como outros sistemas domésticos. ;Integração termostatos;;0;0;;0;0;;0;0;;;;;;;;;;;;;;;Mecânico de Refrigeração e Climatização Residencial;Realizar manutenção de sistemas remotos;;Computadores, Eletrônica e automação;;;Matemática;;Expressão oral;;;Autocontrole;28, 33, 43;282, 331, 432;28232, 28241, 33147, 43223;3314707, 4322302
Refrigeração e Climatização;2022;Crescimento no uso de tubos, conexões e válvulas termoplásticas  na condução de água industrial e água gelada para sistemas de ar-condicionado centrais.;Tubos termoplásticos;;0;0;;0;0;;0;0;;;;;;;;;;;;;;;Mecânico de Refrigeração e Climatização Residencial;Realizar manutenção em Sistema HVAC-R de grande porte;;Serviços;;;Instalação;;Raciocínio matemático;;;Orientação a resultados (Realização/Esforço);28, 33, 43;282, 331, 432;28232, 28241, 33147, 43223;3314707, 4322302
Refrigeração e Climatização;2022;Crescimento de edifícios com envoltórias, que incorporam sistemas para geração de energia e soluções de climatização passiva por meio do uso otimizado de sombreamento, ventilação natural, chaminés solares e poços canadianos, que objetivam a  redução da carga térmica de resfriamento.;Edifícios envoltórias;;0;0;;0;0;;0;0;;;;;;;;;;;;;;;Mecânico de Refrigeração e Climatização Residencial;Operar sistemas de refrigeração comercial modernos (Inverter) envolvendo controladores Inteligentes;;Matemática;;;Manutenção de equipamentos;;Controle e precisão;;;Cooperação;28, 33, 43;282, 331, 432;28232, 28241, 33147, 43223;3314707, 4322302
Refrigeração e Climatização;2022;Crescimento do uso de tecnologias móveis para prestação de serviços pelos profissionais do setor;Tecnologias móveis;;0;0;;0;0;;0;0;;;;;;;;;;;;;;;Mecânico de Refrigeração e Climatização Industrial;Projetar redes de hidráulica;;;;;Manutenção de equipamentos;;Controle e precisão;;;Cooperação;28, 33, 43;282, 331, 432;28232, 28241, 33147, 43223;3314707, 4322302
Metalurgia;2020;Uso, pelas empresas metalurgicas, de tecnologias baseadas em Inteligência Artificial para monitoramento e relacionamento com o mercado.;IA monitoramento;Até 10% do mercado;0;10;11 a 30% do mercado;11;30;11 a 30% do mercado;11;30;Estratégias de comercialização baseadas no oferecimento de serviços inovadores;;11 a 30%;30;11 a 30%;30;;;;0;;0;;;Caldereiro de Manutenção Industrial;Desempenar conjunto e/ou peça quando necessário;;Legislação e Governo;;;Seleção de equipamentos;;Atenção seletiva;;;;24;;;
Metalurgia;2020;Uso, pelas empresas metalurgicas, de visão computacional em etapas do processo produtivo.;Visão computacional;Até 10% do mercado;0;10;Até 10% do mercado;0;10;Até 10% do mercado;0;10;Outros (especificar);;;0;;0;;;;0;;0;;;Caldereiro de Manutenção Industrial;;;Construções;;;Monitoramento de operações;;Compreensão oral;;;;24;;;
Metalurgia;2020;Uso, pelas empresas da cadeia produtiva  metalúrgica, da tecnologia Blockchain.;Blockchain;Até 10% do mercado;0;10;11 a 30% do mercado;11;30;11 a 30% do mercado;11;30;Estratégias de  de Produção baseadas en produção em massa;;31 a 50%;50;31 a 50%;50;;;;0;;0;;;Caldereiro de Manutenção Industrial;;;;;;Operação e controle;;Destreza manual;;;;24;;;
Metalurgia;2020;Uso, pelas empresas metalúrgicas, de sensores móveis (ex. smartphones e tablets) para acesso à informação.;Sensores móveis;11 a 30% do mercado;11;30;31 a 50% do mercado;31;50;51 a 70% do mercado;51;70;Estratégias de  de Produção baseadas em Produção em massa com diferenciação;;11 a 30%;30;11 a 30%;30;;;;0;;0;;;Caldereiro de Manutenção Industrial;;;;;;Gestão do tempo;;Compreensão escrita;;;;24;;;
Metalurgia;2020;Uso, pelas empresas metalúrgicas, de tecnologias de manufatura aditiva (ex. impressoras 3D utilizando polímeros, metais, alimentos entre outros);Manufatura aditiva;Até 10% do mercado;0;10;11 a 30% do mercado;11;30;11 a 30% do mercado;11;30;Estratégias de  de Produção baseadas em Customização em massa;;Até 10%;10;Até 10%;10;;;;0;;0;;;Especialista em Planejamento para a Metalurgia;Definir prazo para chegada de matéria prima para produção;;Administração e Gestão;;;Aprendizagem ativa;;Raciocínio dedutivo;;;;24;;;
Metalurgia;2020;Uso, pelas empresas metalúrgicas, de computação em nuvem para o processamento de dados remotamente;Computação nuvem;11 a 30% do mercado;11;30;31 a 50% do mercado;31;50;51 a 70% do mercado;51;70;Estratégias de  de Produção baseadas em Produção Enxuta (lean manufacturing);;11 a 30%;30;31 a 50%;50;;;;0;;0;;;Especialista em Planejamento para a Metalurgia;Definir número de executantes para reparos/manutenção;;Computadores, Eletrônica e automação;;;Pensamento crítico;;Raciocínio indutivo;;;;24;;;
Metalurgia;2020;Produção, pelas empresas metalúrgicas, de compósitos de aço e grafeno;Aço e grafeno;Não ocorrerá difusão;0;0;Até 10% do mercado;0;10;Até 10% do mercado;0;10;Outro (especificar);;;0;;0;;;;0;;0;;;Especialista em Planejamento para a Metalurgia;Solicitar recursos para o processo produtivo (máquinas e equipamentos);;Comunicações e Mídia;;;Aprendizagem estratégica;;Ordenação de informações;;;;24;;;
Metalurgia;2020;Uso de machine learning para detectar defeitos para automatizar, aumentar a eficiência e manter a alta qualidade da produção do aço.;Machine learning;Até 10% do mercado;0;10;11 a 30% do mercado;11;30;11 a 30% do mercado;11;30;Ferramentas para o processo de tomada de decisão baseadas em análise de mercado;;31 a 50%;50;51 a 70%;70;;;;0;;0;;;Especialista em Planejamento para a Metalurgia;Fornecer recursos para o processo produtivo (máquinas e equipamentos);;Filosofia e Teologia;;;Monitoramento de operações;;Compreensão oral;;;;24;;;
Metalurgia;2020;Uso, pelas empreas metalúrgicas, de sistemas de conectividade e arquitetura modelar de todas as ferramentas em uma unidade de produção de aço, com trocas de informações e fluxo de dados em toda a cadeia de valor;Conectividade modular;Até 10% do mercado;0;10;11 a 30% do mercado;11;30;11 a 30% do mercado;11;30;Ferramentas para o processo de tomada de decisão baseadas no Monitoramento de operaçõesda concorrência (tecnológico ou de mercado);;31 a 50%;50;51 a 70%;70;;;;0;;0;;;Especialista em Planejamento para a Metalurgia;Otimizar logística dos recursos para o processo produtivo (máquinas e equipamentos);;Legislação e Governo;;;Compreensão de leitura;;Expressão oral;;;;24;;;
Metalurgia;2020;Uso de sensores inteligentes para fornecimento de dados necessários para o monitoramento da condição, que coleta entradas de vários níveis de automação para avaliar e visualizar as condições dos equipamentos e os respectivos processos.;Sensores inteligentes;11 a 30% do mercado;11;30;31 a 50% do mercado;31;50;31 a 50% do mercado;31;50;Ferramentas para o processo de tomada de decisão baseadas na identificação de tendências tecnológicas (prospectiva tecnológica);;31 a 50%;50;51 a 70%;70;;;;0;;0;;;Especialista em Planejamento para a Metalurgia;Otimizar níveis de estoque de matéria prima;;Língua Estrangeira;;;Comunicação;;Percepção de problemas;;;;24;;;
Metalurgia;2020;Produção, pelas empresas metalúrgicas, de ligas leves;Ligas leves;Até 10% do mercado;0;10;Até 10% do mercado;0;10;11 a 30% do mercado;11;30;Ferramentas para o processo de tomada de decisão baseadas no desenvolvimento, gestão e avaliação de seus projetos;;Até 10%;10;11 a 30%;30;;;;0;;0;;;Especialista em Planejamento para a Metalurgia;Criar mapas de paradas de manutenção;;Língua Portuguesa;;;Persuasão;;Velocidade de organização e resposta;;;;24;;;
Metalurgia;2020;Produção, pelas empresas metalúrgicas, de ligas especiais;Ligas especiais;11 a 30% do mercado;11;30;31 a 50% do mercado;31;50;31 a 50% do mercado;31;50;Outro (especificar);;;0;;0;;;;0;;0;;;Especialista em Planejamento para a Metalurgia;Criar mapas de plano de produção;;Matemática;;;Orientação a serviços;;Multitarefa;;;;24;;;
Metalurgia;2020;Tecnologias para monitoramento e redução do impacto ambiental (sustentabilidade);Monitoramento ambiental;31 a 50% do mercado;31;50;51 a 70% do mercado;51;70;51 a 70% do mercado;51;70;Estratégias para atração, identificação, desenvolvimento e retenção de talentos baseadas no estabelecimento de  remunerações  fixa e variável e programas de benefícios/benefícios flexíveis (cardápios de benefícios).;;Até 10%;10;11 a 30%;30;;;;0;;0;;;Especialista em Planejamento para a Metalurgia;Criar mapas de planejamento estratégico;;Mecânica;;;Análise de sistemas;;Compreensão escrita;;;;24;;;
Metalurgia;2020;Tecnologia para reaproveitamento de resíduos e agregação de valor a esse resíduo (Ciclo de Vida do Produto);Reaproveitamento resíduos;51 a 70% do mercado;51;70;51 a 70% do mercado;51;70;51 a 70% do mercado;51;70;Estratégias para atração, identificação, desenvolvimento e retenção de talentos baseadas na existência de programas de desenvolvimento de carreira e programas de capacitação e aprendizagem.;;11 a 30%;30;31 a 50%;50;;;;0;;0;;;Especialista em Planejamento para a Metalurgia;Controlar KPIs definidos pela gerência;;Produção e Processamento;;;Avaliação de sistemas;;Expressão escrita;;;;24;;;
Metalurgia;2020;Tecnologia para monitoramento de comportamento e produtividade do trabalhador objetivando a segurança e saúde ocupacional,;Monitoramento trabalhador;Até 10% do mercado;0;10;11 a 30% do mercado;11;30;31 a 50% do mercado;31;50;Estratégias para atração, identificação, desenvolvimento e retenção de talentos baseadas na existência de programas de qualidade de vida no trabalho e programas de coaching.;;11 a 30%;30;31 a 50%;50;;;;0;;0;;;Especialista em Planejamento para a Metalurgia;Elaborar planejamento integrado da produção/manutenção;;Psicologia;;;Gestão de recursos financeiros;;;;;;24;;;
Metalurgia;2020;;;;0;0;;0;0;;0;0;Estratégias para atração, identificação, desenvolvimento e retenção de talentos baseadas na existência de estrutura organizacional descentralizada,  democratização da informação.;;Até 10%;10;Até 10%;10;;;;0;;0;;;Especialista em Planejamento para a Metalurgia;Elaborar relatórios periódicos para gerência;;Química;;;Gestão de recursos de materiais;;;;;;24;;;
