Biogás;2018;Desenvolvimento de tecnologias para valorização do Digestato - Biofertilizante/Organomineral;Valorização do digestato;Até 10% do mercado;0;10;11 a 30% do mercado;11;30;11 a 30% do mercado;11;30;Estratégias de comercialização baseadas no:;Oferecimento de produtos inovadores;11 a 30%;30;Até 10%;10;Técnico em instalação e manutenção de biodigestores;Montagem, comissionamento, descomissionamento, manutenção;Até 10% das empresas;10;11 a 30% das empresas;30;elétrica, mecânica, hidráulica, civil;operação, Monitoramento de operações e Análise de controle de qualidade;Operador de Planta de Biogás;Operar o sistema de tratamento e purificação do biogás, cumprindo as instruções, avisos, normas de operação e segurança.;;Mecânica;;;Orientação a serviços;;Velocidade perceptiva;;Técnico em Reaproveitamento Energético e Soluções Ambientais;;19, 35;193;19322;
Biogás;2018;Desenvolvimento de tecnologias para separação seletiva de RSU (orgânicos);Separação seletiva RSU;Até 10% do mercado;0;10;Até 10% do mercado;0;10;11 a 30% do mercado;11;30;Estratégias de comercialização baseadas no:;Oferecimento de soluções (produtos + serviços);31 a 50%;50;51 a 70%;70;Operadores de biodigestores;Operação de planta de biodigestor, atividades rotineiras envolvendo o biogás;Até 10% das empresas;10;11 a 30% das empresas;30;biologia, noções de mecânica elétrica, química, matemática, língua portuguesa;operação, Monitoramento de operaçõese controle de operações, Análise de sistemas, Análise de controle de qualidade, percepção de problemas;Operador de Planta de Biogás;Executar ações básicas de Monitoramento de operações para o bom funcionamento dos equipamentos das plantas.;;Matemática;;;Operação e controle;;Atenção auditiva;;Operador de Plantas de Biogás;;19, 35;193;19322;
Biogás;2018;Desenvolvimento de tecnologias para tratamento de Biogás - (H2S, particulados, Umidade, etc.);Tratamento de biogás;Até 10% do mercado;0;10;11 a 30% do mercado;11;30;31 a 50% do mercado;31;50;Estratégias de comercialização baseadas no:;Oferecimento de serviços inovadores;31 a 50%;50;31 a 50%;50;Especialista em cadeia de produção e uso  de biogás;Elaboração de projetos, administração e gestão de sistema de biogás;Até 10% das empresas;10;11 a 30% das empresas;30;administração e gestão, biologia, química, matemática, construções, física, engenharia e tecnologia, estudos de viabilidade de projetos, produção e processamento, telecomunicações;pensamento crítico, aprendizagem estratégica, Monitoramento de operações, Resolução de problemas complexos, coordenação, Orientação a serviços, julgamento e tomada de decisão;Operador de Planta de Biogás;Controlar a qualidade dos produtos (energia elétrica, biometano e biofertiliante);;Gestão;;;Monitoramento de operações;;Sensibilidade olfativa;;;;19, 35;193;19322;
Confecção de Vestuário;2021;Uso de tecnologias especializadas em design de padrões;Design de padrões;31 a 50% do mercado;31;50;51 a 70% do mercado;51;70;;0;0;;;;;;;Especialista em Relacionamento com o Cliente;Atuar na implantação de métodos e processos para identifi_x0002_car e analisar, de forma aprofunda_x0002_da, o comportamento emocional e psicológico de clientes e nichos de mercado em constante mudança.;;;;;;;Tecnólogo em Produção do Vestuário;Aplicar processos de Lean manufacturing;;Pessoal e Recursos Humanos;;;Aprendizagem ativa;;Expressão oral;;;;14;;;
Confecção de Vestuário;2021;Oferta de artigos que absorvam a umidade mais rapidamente.;Artigos anti-umidade;11 a 30% do mercado;11;30;51 a 70% do mercado;51;70;;0;0;;;;;;;Especialista em Sustentabilidade Têxtil;Implementar nas empresas ferramentas e metodologias que di_x0002_recionem a produção para proces_x0002_sos sustentáveis e gestão de risco;;;;;;;Tecnólogo em Produção do Vestuário;Implementar tecnologias da automação e digitalização tais como internet das coisas (loT) e sistemas 3D;;Administração e Gestão;;;Análise de operações;;Atenção seletiva;;;;14;;;
Construção Civil;2018;Uso, pelas empresas de construção civil, de sistema de Geração Distribuída de Energia;Geração distribuída;31 a 50% do mercado;31;50;51 a 70% do mercado;51;70;;0;0;Estratégias de comercialização baseadas no:;Oferecimento de soluções (produtos + serviços);11 a 30%;30;31 a 50%;50;Inspetor Técnico para execução dos requisitos da NBR15575;Inspeção de qualidade da execução referente aos itens da NBR15575;Até 10% das empresas;10;11 a 30% das empresas;30;;;Desenhista de esquadrias de alumínio;;;Legislação e Governo;;;Aprendizagem ativa;;Criatividade/originalidade;;;;41, 42, 43;;;
Construção Civil;2018;Uso, pelas empresas de construção civil, de sistema de Revestimento de Fachada Industrializada;Revestimento industrializado;11 a 30% do mercado;11;30;11 a 30% do mercado;11;30;;0;0;Estratégias de comercialização baseadas no:;Oferecimento de serviços inovadores;11 a 30%;30;31 a 50%;50;Montador de superestrutura metálica;Execução de montagem de superestruturas metálicas;Até 10% das empresas;10;11 a 30% das empresas;30;;;Desenhista de esquadrias de alumínio;;;Design;;;Pensamento crítico;;Criatividade/originalidade;;;;41, 42, 43;;;
Construção Civil;2018;Uso, pelas empresas de construção civil, de estruturas Pré-Fabricadas/Pré-Moldadas;Estruturas pré-fabricadas;11 a 30% do mercado;11;30;31 a 50% do mercado;31;50;;0;0;Estratégias de posicionamento no mercado baseadas em:;Liderança por diferenciação;Até 10%;10;Até 10%;10;Integrador de sistema de automação predial;Compatibilização e integração das necessidades relativas à automação predial;Até 10% das empresas;10;Até 10% das empresas;10;;;Desenhista de esquadrias de alumínio;Realizar conferência de medidas no local.;Acompanhar a produção do protótipo.;Construções;;;Compreensão de leitura;;Ordenação de informações;;;;41, 42, 43;;;
Construção Civil;2018;Uso, pelas empresas de construção civil, de processos construtivos mecanizados/automatizados;Construção mecanizada;Até 10% do mercado;0;10;11 a 30% do mercado;11;30;;0;0;Estratégias de posicionamento no mercado baseadas em:;Nichos de mercado (custos ou diferenciação);31 a 50%;50;51 a 70%;70;Instalador de sistema de automação predial;"Instalação dos sistemas de automação predial (elétrica; eletrônica e TI)";Até 10% das empresas;10;Até 10% das empresas;10;;;Desenhista de esquadrias de alumínio;Desenvolver o detalhamento da esquadria em software específico.;Verificar por amostragem o produto final.;Computadores, Eletrônica e automação;;;Gestão do tempo;;Compreensão oral;;;;41, 42, 43;;;
Construção Civil;2018;Uso, pelas empresas de construção civil, de processos construtivos racionalizados;Construção a seco;51 a 70% do mercado;51;70;51 a 70% do mercado;51;70;;0;0;Estratégias de posicionamento no mercado baseadas em:;Outros (especificar);;0;;0;Bloqueiro com foco em alvenaria de vedação racionalizada e estrutural;Execução de alvenaria de vedação racionalizada e estrutural;11 a 30% das empresas;30;31 a 50% das empresas;50;;;Desenhista de esquadrias de alumínio;Verificar compatibilidade entre os componentes da esquadria de alumínio.;;Língua Portuguesa;;;Orientação a serviços;;Raciocínio matemático;;;;41, 42, 43;;;
Construção Civil;2018;Uso, pelas empresas de construção civil, de sistema de construção a seco;Sensores inteligentes;11 a 30% do mercado;11;30;11 a 30% do mercado;11;30;;0;0;Estratégias de comercialização baseadas no:;Oferecimento de produtos inovadores;Até 10%;10;Até 10%;10;Montador de Formas metálicas para parede de concreto;Montagem de Formas metálicas para parede de concreto;Até 10% das empresas;10;Até 10% das empresas;10;;;Desenhista de esquadrias de alumínio;Realizar revisão do desenho, caso necessário.;;Produção e Processamento;;;Análise de operações;;Expressão oral;;;;41, 42, 43;;;
Eletroeletrônico;2019;Uso, pelas empresas industriais, de tecnologias para sensoriamento inteligente (com conectividade, Analitics, Big data);Realidade aumentada;Até 10% do mercado;0;10;Até 10% do mercado;0;10;11 a 30% do mercado;11;30;Ferramentas para o processo de tomada de decisão;Ferramentas para desenvolvimento, gestão e avaliação de seus projetos;31 a 50%;50;51 a 70%;70;Técnico de segurança patrimonial;Profissional responsável pela coordenação de sistemas de segurança patrimonial (alarme, CFTV, sistemas de proteção contra incêndio, perimetrais eletrônicas, controle de acesso, drones, portaria virtuais,  ...), acompanhando a implementação, executando a operação e a manutenção.;Até 10% das empresas;10;11 a 30% das empresas;30;;;Técnico em eletroeletrônica;Conceber ensaios de controle técnicos dos produtos;;Matemática;;;Gestão do tempo;;Percepção de problemas;;;;26;;;
Eletroeletrônico;2019;Digitalização da produção com sensores para identificação de produtos e condições operacionais.;Engenharia integrada;Até 10% do mercado;0;10;Até 10% do mercado;0;10;11 a 30% do mercado;11;30;Estratégias de posicionamento no mercado baseadas em:;Outros (especificar);;0;;0;Técnico em Big Data (Cientista de dados);Profissional responsável por implementar programação avançada baseado em dados observados, que podem influencia o sistema, responsável por estudos de inteligência artificial(comparação de inteligências), criação de softwares.;Até 10% das empresas;10;11 a 30% das empresas;30;;;Eletricista industrial;Realizar operação da manutenção de sistemas elétricos;;Produção e Processamento;;;Instalação;;Compreensão escrita;Inovação;;;26;;;
Eletroeletrônico;2019;Uso, pelas empresas industriais, da tecnologia de realidade aumentada.;IA no mercado;Até 10% do mercado;0;10;11 a 30% do mercado;11;30;11 a 30% do mercado;11;30;Estratégias de comercialização baseadas no:;Oferecimento de produtos inovadores;11 a 30%;30;31 a 50%;50;Técnico em demótica;Profissional responsável por desenvolver e instalar sistemas automatizados para residências, eficiência energética,;11 a 30% das empresas;30;31 a 50% das empresas;50;;;Eletricista industrial;Realizar otimização/retrofitting de instalações elétricas;;Psicologia;;;Operação e controle;;Coordenação dos membros superiores e inferiores;Persistência;;;26;;;
Eletroeletrônico;2019;Uso, pelas empresas industriais, de sistemas integrados de engenharia para manufatura de produtos.;Visão computacional;Até 10% do mercado;0;10;Até 10% do mercado;0;10;Até 10% do mercado;0;10;Estratégias de comercialização baseadas no:;Oferecimento de soluções (produtos + serviços);31 a 50%;50;51 a 70%;70;Técnico em comunicações wireless;Profissional responsável por projetar desenvolver,  instalar e otimizar redes de comunicações  sem fio(antenas , rádios, roteadores, AP. Avaliar a qualidade de sinais transmitidos/recebidos, instalação;11 a 30% das empresas;30;31 a 50% das empresas;50;;;Eletricista industrial;Utilizar ferramentas computacionais para operação e manutenção de sistemas elétricos;;Serviços;;;Reparos;;Coordenação corporal;;;;26;;;
Eletroeletrônico;2019;Uso, pelas empresas industriais, de tecnologias baseadas em Inteligência Artificial para monitoramento e relacionamento com o mercado.;Redes LPWA para IoT;Até 10% do mercado;0;10;Até 10% do mercado;0;10;11 a 30% do mercado;11;30;Estratégias de comercialização baseadas no:;Oferecimento de serviços inovadores;11 a 30%;30;51 a 70%;70;Profissional para validação de produto (qualificação para o técnico);Profissional responsável por teste e validações de hardwares, Firmware e APP,;11 a 30% das empresas;30;31 a 50% das empresas;50;;;Eletricista industrial;;;Telecomunicações;;;Solução de problemas;;Percepção de problemas;;;;26;;;
Eletroeletrônico;2019;Uso, pelas empresas industriais, de visão computacional em etapas do processo produtivo.;Tecnologia eólica off-shore;11 a 30% do mercado;11;30;31 a 50% do mercado;31;50;31 a 50% do mercado;31;50;Estratégias de comercialização baseadas no:;Outros (especificar);;0;;0;Tecnólogo em eletrônica Industrial e TI;Profissional responsável pelo desenvolvimento de  equipamentos e sistemas eletrônicos para automação, integrados a redes e sistemas . corporativos.;31 a 50% das empresas;50;51 a 70% das empresas;70;;;Eletricista industrial;;;;;;Julgamento e tomada de decisões;;Visão periférica;;;;26;;;
Eletroeletrônico;2019;Uso, pelas empresas industriais, de redes LPWA (low Power wide área) - Redes para IoT;Manutenção ultrassom;Até 10% do mercado;0;10;Até 10% do mercado;0;10;11 a 30% do mercado;11;30;Estratégias de   Produção baseadas na:;Produção em massa;31 a 50%;50;11 a 30%;30;Especialista em manutenção de veículos híbridos, elétricos e autônomos.;Profissional responsável pela manutenção mecânica, elétrica e eletrônica em veículos híbridos, elétricos e autônomos.;11 a 30% das empresas;30;51 a 70% das empresas;70;;;Eletricista industrial;;;;;;;;Multitarefa;;;;26;;;
Eletroeletrônico;2019;Uso, pelas empresas industriais, de sistemas embarcados (carro elétrico, motorização elétrica);Energia eólica on-shore;Até 10% do mercado;0;10;Até 10% do mercado;0;10;11 a 30% do mercado;11;30;Estratégias de   Produção baseadas na:;Produção em massa com diferenciação;31 a 50%;50;51 a 70%;70;Eletricista instalador de sistemas de energias renováveis;Profissional responsável pela execução de instalação de sistemas de energias renováveis e sistemas de eficiência energética;Até 10% das empresas;10;Até 10% das empresas;10;;;Eletricista industrial;;;;;;;;Expressão oral;;;;26;;;
Energias Renováveis;2018;Obtenção de energia por meio de sistemas eólicos off-shore;Ímãs permanentes;Não ocorrerá difusão;0;0;Até 10% do mercado;0;10;;0;0;;;;0;;0;Técnico de Comissionament de Aerogeradores;Realizar testes e comisisonar Aerogeradores;31 a 50% das empresas;50;31 a 50% das empresas;50;;;Confeccionador de componentes de materiais compósitos;Interpretar instruções de trabalho;;Design;;;Comunicação;;Expressão oral;;;;35;;;
Energias Renováveis;2018;Uso de tecnologias para  manutenção de aerogeradores que utilizam turbinas de grande porte com rotor horizontal de três pás com controle de pitch com potências unitárias superiores a 4 MW;Pás otimizadas;31 a 50% do mercado;31;50;51 a 70% do mercado;51;70;;0;0;;;;0;;0;Inspetor de Qualidade de Aerogeradores;Realizar inspeção de recebimento, de montagem, etc. em parques eólicos;11 a 30% das empresas;30;31 a 50% das empresas;50;;;Confeccionador de componentes de materiais compósitos;Preencher formulários relativos aos processos;;Mecânica;;;Monitoramento de operações;;Orientação espacial;;;;35;;;
Energias Renováveis;2018;Uso de navios especiais para o transporte e a instalação de aerogeradores previamente montados e comissionados;Armazenamento eólico;Não ocorrerá difusão;0;0;Até 10% do mercado;0;10;;0;0;;;;0;;0;Técnico de Reparo de Torres de Concreto;Realizar reparos de torres de concreto de Aerogeradores;Até 10% das empresas;10;11 a 30% das empresas;30;;;Confeccionador de componentes de materiais compósitos;Manipular materiais químicos;;Física;;;Escuta ativa;;Compreensão oral;;;;35;;;
Energias Renováveis;2018;Uso de tecnologias para instalação e montagem de aerogeradores que utilizam turbinas de grande porte com rotor horizontal de três pás com controle de pitch com potências unitárias superiores a 4 MW on-shore;Manutenção aerogeradores;31 a 50% do mercado;31;50;51 a 70% do mercado;51;70;;0;0;;;;0;;0;Técnico de Operação e Manutenção de Aerogeradores;Realizar O&M de Aerogeradores;31 a 50% das empresas;50;51 a 70% das empresas;70;;;Confeccionador de componentes de materiais compósitos;Movimentar cargas;;Legislação e Governo;;;Gestão de recursos de materiais;;Multitarefa;;;;35;;;
Energias Renováveis;2018;Uso de tecnologias para  operação de aerogeradores que utilizam turbinas de grande porte com rotor horizontal de três pás com controle de pitch com potências unitárias superiores a 4 MW;Aerogeradores pequenos;31 a 50% do mercado;31;50;51 a 70% do mercado;51;70;;0;0;;;;0;;0;Técnico de Operação de Parques Eólicos;Realizar Operação de Parques Eólicos;11 a 30% das empresas;30;31 a 50% das empresas;50;;;Confeccionador de componentes de materiais compósitos;Operar máquinas e equipamentos utilizados na fabricação;;Matemática;;;Gestão do tempo;;Ordenação de informações;;;;35;;;
Energias Renováveis;2018;Obtenção de energia por meio de sistemas eólicos on-shore por meio de aerogeradores que utilizam turbinas de grande porte com rotor horizontal de três pás com controle de pitch com potências unitárias superiores a 4 MW;Conversores de potência;31 a 50% do mercado;31;50;51 a 70% do mercado;51;70;;0;0;;;;0;;0;Técnico de Instalação de Aerogeradores;Instalar novos Aerogeradores;31 a 50% das empresas;50;31 a 50% das empresas;50;;;Confeccionador de componentes de materiais compósitos;Instalar dispositivos (colagem e adesivação) no corpo da pá (Vortex generator, zig zag tape);;Computadores, Eletrônica e automação;;;Compreensão de leitura;Instrução;Atenção seletiva;;;;35;;;
Energias Renováveis;2018;Uso da tecnologia de Ímã permanente em  para máquinas elétricas de alto desempenho;Controle inteligente;11 a 30% do mercado;11;30;31 a 50% do mercado;31;50;;0;0;;;;0;;0;Instalador de Sistemas de Concentração Solar;Instalar Sistemas de Concentração de médias e altas temperaturas;Até 10% das empresas;10;11 a 30% das empresas;30;;;Instalador de sistemas de aquecimento solar de médio e grande porte;Interpretar projetos;;Geografia;;;Gestão de recursos de materiais;;Coordenação dos membros superiores e inferiores;;;;35;;;
Energias Renováveis;2018;Uso de pás em rotores horizontais otimizadas para o padrão de ventos do Brasil;Pás controle passivo;31 a 50% do mercado;31;50;51 a 70% do mercado;51;70;;0;0;;;;0;;0;Instalador de ar condicionado solar;Instalar ar condicionado solar;Até 10% das empresas;10;Até 10% das empresas;10;;;Instalador de sistemas de aquecimento solar de médio e grande porte;Realizar sob supervisão comissionamento da instalação;;Legislação e Governo;;;Instalação;;Equilíbrio corporal;;;;35;;;
Energias Renováveis;2018;Incorporação de tecnologia de armazenamento de larga escala em sistemas de geração eólico;Fibra de carbono;Até 10% do mercado;0;10;11 a 30% do mercado;11;30;;0;0;;;;0;;0;Instalador de refrigeração solar;Instalar refrigeradores solares;Até 10% das empresas;10;Até 10% das empresas;10;;;Instalador de sistemas de aquecimento solar de médio e grande porte;Realizar sob supervisão manutenções preditiva nos equipamentos e periféricos;;Língua Portuguesa;;;Manutenção de equipamentos;;Multitarefa;;;;35;;;
Energias Renováveis;2018;Incorporação de novas tecnologia de armazenamento para suprimento de emergência em sistemas de pitch;Impressoras 3D;Até 10% do mercado;0;10;11 a 30% do mercado;11;30;;0;0;;;;0;;0;Piloto técnico de drone;Realizar inspeção aérea com uso de drones para análises do local, termografia, etc.;Até 10% das empresas;10;11 a 30% das empresas;30;;;Instalador de sistemas de aquecimento solar de médio e grande porte;Realizar testes de isolamento térmico, pressão hidráulica, elétricos e gás.;;Matemática;;;Matemática;;Orientação espacial;;;;35;;;
Energias Renováveis;2018;Uso de tecnologias de ultrassom e vídeo buroscopia para manutenção de pás de aerogeradores;Prototipagem rápida;Até 10% do mercado;0;10;31 a 50% do mercado;31;50;;0;0;;;;0;;0;Técnico Especialista em concreto;Realizar o Monitoramento de operaçõese reparo de fundações de Aerogeradores;Até 10% das empresas;10;11 a 30% das empresas;30;;;Confeccionador de componentes de materiais compósitos;Realizar ensaios de conformidade de insumos e cura de material;;Produção e Processamento;;;Operação e controle;;Percepção de problemas;;;;35;;;
Energias Renováveis;2018;Uso de aerogeradores de pequeno porte - até 100 kW;Controle temperatura;Não ocorrerá difusão;0;0;Até 10% do mercado;0;10;;0;0;;;;0;;0;Técnico de Protensão de Torres Eólicas;Realizar a protensão de Torres de concreto de Aerogeradores;Até 10% das empresas;10;11 a 30% das empresas;30;;;Confeccionador de componentes de materiais compósitos;Realizar pintura de pás eólicas;;Química;;;Orientação a serviços;;Velocidade perceptiva;;;;35;;;
Energias Renováveis;2018;Uso de aerogeradores  com rotor vertical de pequeno e médio porte;Monitoramento ruído/vibração;Não ocorrerá difusão;0;0;Até 10% do mercado;0;10;;0;0;;;;0;;0;Técnico Especialista em Torres anemométricas;Realizar o Monitoramento de operaçõesreparo de torres anemométricas (equipamentos de medição);Até 10% das empresas;10;11 a 30% das empresas;30;;;Confeccionador de componentes de materiais compósitos;Realizar procedimento de lixamento;;Serviços;;;Reparos;;;;;;35;;;
Energias Renováveis;2018;Uso de conversores de potência para a compensação de reativos em grandes parques eólicos;Biofibras;51 a 70% do mercado;51;70;51 a 70% do mercado;51;70;;0;0;;;;0;;0;Especialista de Monitoramento de operaçõesde performance de parques eólicos;Acompanhar a operação dos aerogeradores e parque eólico em busca da melhoria da performance;Até 10% das empresas;10;11 a 30% das empresas;30;;;Confeccionador de componentes de materiais compósitos;Realizar procedimentos de corte;;Transportes;;;Seleção de equipamentos;;;;;;35;;;
Energias Renováveis;2018;Uso de sistemas de controle inteligentes em grandes parques eólicos para a conexão com a rede elétrica;Digitalização têxtil;51 a 70% do mercado;51;70;51 a 70% do mercado;51;70;;0;0;;;;0;;0;Especialista em videoboroscopia de gearbox;Realizar inspeções em gearbox;31 a 50% das empresas;50;51 a 70% das empresas;70;;;Confeccionador de componentes de materiais compósitos;Realizar procedimentos de operação (regulagem e ajuste) de máquinas;;;;;;;;;;;35;;;
Energias Renováveis;2018;Uso de pás com controle passivo em turbinas de pequeno porte;Realidade aumentada;Não ocorrerá difusão;0;0;Até 10% do mercado;0;10;;0;0;;;;0;;0;Operador e mantenedor de usinas fotovoltaicas;Operar usinas fotovoltaicas, realizar limpeza de módulos fotovoltaicos, testes de rotina;Até 10% das empresas;10;Até 10% das empresas;10;;;Instalador de sistemas de aquecimento solar de médio e grande porte;Executar instalações atendendo normas vigentes;Integrar o SAS em processos do agronegócio;Design;;;Comunicação;;Expressão oral;;;;35;;;
Energias Renováveis;2018;Uso de fibra de carbono visando a confecção de pás mais leves e resistentes;Engenharia integrada;11 a 30% do mercado;11;30;31 a 50% do mercado;31;50;;0;0;;;;0;;0;Instalador de PVT´s;Trabalhar com 2 tecnologias: térmica e fotovoltaica;Até 10% das empresas;10;11 a 30% das empresas;30;;;Instalador de sistemas de aquecimento solar de médio e grande porte;Instalar quadro de comandos elétricos;Integrar o SAS em processos industriais;Física;;;Condução de veículos;;Compreensão oral;;;;35;;;
Metal Mecânica;2019;Uso, pelas empresas de metal mecânica, de Impressoras 3D;IA monitoramento;11 a 30% do mercado;11;30;31 a 50% do mercado;31;50;31 a 50% do mercado;31;50;Estratégias de comercialização baseadas no:;Oferecimento de soluções (produtos + serviços);11 a 30%;30;11 a 30%;30;Operador e programador para prototipagem de componentes biomédicos;Este profissional será o responsável pelo projeto, por meio eletrônico, de componentes e conjuntos biomecânicos e biomédicos,  análise da demanda, e confecção de protótipos, utilizando sistemas Cax.;Até 10% das empresas;10;11 a 30% das empresas;30;"Biotecnologia; CAD,CAE,CAM,CAI; Engenharia reversa,  fundamentos materiais biomédicos, metrologia, realidade virtual,";"Operação e controle; Programação; Análise de controle de qualidade; Seleção de equipamentos; Projeto de tecnologias; Solução de problemas";Mecâncio de Manutenção de Máquinas-Ferramentas (Usinagem de metais);Analisar causas e efeitos das falhas mecânicas de máquinas industriais;Realizar a manutenção de máquinas de Alta Velocidade (High Speed Cutting);Língua Estrangeira;;;Resolução de problemas complexos;;Equilíbrio corporal;;;;24, 25, 28;;;
Metal Mecânica;2019;Uso, pelas empresas de metal mecânica, do processo de prototipagem Rápida (polimerização de resina);Visão computacional;11 a 30% do mercado;11;30;31 a 50% do mercado;31;50;31 a 50% do mercado;31;50;Estratégias de posicionamento no mercado baseadas em:;Oportunidade de mercado (start up, por exemplo);Até 10%;10;Até 10%;10;Administrador de conectividade;Este profissional será o responsável por garantir a velocidade e integridade de processamento, além da estabilidade e disponibilidade da rede para conectividade das máquinas automatizadas.;Até 10% das empresas;10;Até 10% das empresas;10;"Ciência da computação aplicada; Computadores e eletrônica; Tipos de redes; tipos de transmissão de dados.";"Fluência digital; Inovação;";Mecâncio de Manutenção de Máquinas-Ferramentas (Usinagem de metais);Realizar a manutenção preventiva de máquinas industriais;Realizar a manutenção de sistemas de medição óptica.;Engenharia e Tecnologias;;;Solução de problemas;Reconhecimento de padrões;Criatividade/originalidade;Iniciativa;;;24, 25, 28;;;
