Têxtil;2019;Fabricação, pelas empresas, de artigos têxteis funcionais, para confecção de uniformes para militares, policiais e bombeiros.;Têxteis funcionais;11 a 30% do mercado;11;30;11 a 30% do mercado;11;30;31 a 50% do mercado;31;50;Estratégias para atração, identificação, desenvolvimento e retenção de talentos baseadas no(a):;Existência de projetos e ações que permitam o comprometimento e o empowerment dos colaboradores.;Até 10%;10;De 11 a 30%;0;;;;0;;0;;;Operador de beneficiamentos têxteis;;;;;;;;;;;;13;;;
Têxtil;2019;Produção, pelas empresas têxteis, de tecidos industriais (têxtil técnico) aplicados à construção ao setor de transporte (aviação, embarcações e automotivo);Tecidos industriais;Até 10% do mercado;0;10;Até 10% do mercado;0;10;Até 10% do mercado;0;10;Estratégias para atração, identificação, desenvolvimento e retenção de talentos baseadas no(a):;Estrategias focando propositos pessoais com objetivo coletivo;Até 10%;10;Até 10%;10;;;;0;;0;;;Operador de beneficiamentos têxteis;;;;;;;;;;;;13;;;
Têxtil;2019;Uso, pelas empresas têxteis, de processos de estamparia digital.;Estamparia digital;Até 10% do mercado;0;10;11 a 30% do mercado;11;30;11 a 30% do mercado;11;30;Estabelecimento de metas financeiras e não financeiras;Facilmente mensuráveis;31 a 50%;50;De 51 a 70%;0;;;;0;;0;;;Operador de beneficiamentos têxteis;;;;;;;;;;;;13;;;
Têxtil;2019;Uso, pelas empresas têxteis, de impressoras 3D para fabricação de peças prontas;Impressoras 3D têxteis;Não ocorrerá difusão;0;0;Até 10% do mercado;0;10;Até 10% do mercado;0;10;Estabelecimento de metas financeiras e não financeiras;Claras e transparentes com a participação dos funcionários envolvidos;Até 10%;10;De 11 a 30%;0;;;;0;;0;;;Operador de beneficiamentos têxteis;;;;;;;;;;;;13;;;
Têxtil;2019;Uso, pelas empresas têxteis, de corantes naturais em seus processos de tingmento;Corantes naturais;11 a 30% do mercado;11;30;11 a 30% do mercado;11;30;31 a 50% do mercado;31;50;Estabelecimento de metas financeiras e não financeiras;Factíveis e alinhadas com a estratégia corporativa;Até 10%;10;De 11 a 30%;0;;;;0;;0;;;Operador de beneficiamentos têxteis;;;;;;;;;;;;13;;;
Têxtil;2019;Uso, pelas empresa têxteis, de processos de acabamento com de nanopartículas para produção de tecidos com propriedades multifuncionais (ex. resistência ultravioleta, repelência a líquidos, propriedades antirrugas, antibacterianas).;Acabamento nanopartículas;11 a 30% do mercado;11;30;11 a 30% do mercado;11;30;11 a 30% do mercado;11;30;Estabelecimento de metas financeiras e não financeiras;Metas para conservação de energia e sustentabilidade;Até 10%;10;De 11 a 30%;0;;;;0;;0;;;Operador de beneficiamentos têxteis;;;;;;;;;;;;13;;;
Têxtil;2019;Uso, pelas empresas têxteis, de processo de beneficiamento por plasma para otimizar as propriedades de umectação e adesão de superfícies têxteis.;Beneficiamento plasma;Até 10% do mercado;0;10;Até 10% do mercado;0;10;11 a 30% do mercado;11;30;Estabelecimento de indicadores de desempenho;Estabelecidos de forma de forma clara e transparente com a participação dos funcionários envolvidos?;Até 10%;10;De 11 a 30%;0;;;;0;;0;;;Operador de beneficiamentos têxteis;;;;;;;;;;;;13;;;
Têxtil;2019;Uso, pelas empresas têxteis, de materiais que alteram suas propriedades de acordo com impulsos ou com as condições do ambiente.;Materiais adaptativos;Até 10% do mercado;0;10;Até 10% do mercado;0;10;11 a 30% do mercado;11;30;Estabelecimento de indicadores de desempenho;Com foco equilibrado entre o desempenho financeiro e não financeiro?;Até 10%;10;De 11 a 30%;0;;;;0;;0;;;Operador de beneficiamentos têxteis;;;;;;;;;;;;13;;;
Têxtil;2019;Uso, pelas empresas têxteis, de ferramentas para rastreamento e registro de materiais e produtos na cadeia de suprimento;Rastreamento têxtil;Até 10% do mercado;0;10;Até 10% do mercado;0;10;11 a 30% do mercado;11;30;Estabelecimento de indicadores de desempenho;Facilmente mensuráveis;31 a 50%;50;De 51 a 70%;0;;;;0;;0;;;Operador de beneficiamentos têxteis;;;;;;;;;;;;13;;;
Têxtil;2019;Uso, pelas empresas têxteis de equipamentos e procesos para economia e recuperação de energía.;Economia energia têxtil;11 a 30% do mercado;11;30;11 a 30% do mercado;11;30;31 a 50% do mercado;31;50;Ferramentas para o processo de tomada de decisão;Ferramentas para desenvolvimento, gestão e avaliação de seus projetos;Até 10%;10;De 11 a 30%;0;;;;0;;0;;;Operador de beneficiamentos têxteis;;;Química;;;Operação e controle;;Multitarefa;;;;13;;;
Têxtil;2019;Uso, pelas empresas têxteis, de tecnologias para reciclagem.;Reciclagem têxtil;11 a 30% do mercado;11;30;31 a 50% do mercado;31;50;31 a 50% do mercado;31;50;Estratégias para atração, identificação, desenvolvimento e retenção de talentos baseadas no(a):;Estabelecimento de  remunerações  fixa e variável e programas de benefícios/benefícios flexíveis (cardápios de benefícios).;11 a 30%;30;De 11 a 30%;0;;;;0;;0;;;Operador de beneficiamentos têxteis;;;Legislação e Governo;;;Monitoramento de operações;;Percepção de problemas;;;;13;;;
Têxtil;2019;Uso, pelas empresas têxteis, de bioprocessos que substituem processos químicos nos tratamentos têxteis.;Bioprocessos têxteis;Até 10% do mercado;0;10;11 a 30% do mercado;11;30;11 a 30% do mercado;11;30;Estratégias para atração, identificação, desenvolvimento e retenção de talentos baseadas no(a):;Existência de programas de desenvolvimento de carreira e programas de capacitação e aprendizagem.;Até 10%;10;De 11 a 30%;0;;;;0;;0;;;Operador de beneficiamentos têxteis;;;;;;Reparos;;Destreza manual;;;;13;;;
Têxtil;2019;Uso, pelas empresas têxteis, de produtos auxiliares de base biológica em aplicações BAT (Best Available Techniques) e técnicas emergentes que minimizem o impacto ambiental dos processos têxteis.;Produtos biológicos;11 a 30% do mercado;11;30;11 a 30% do mercado;11;30;31 a 50% do mercado;31;50;Estratégias para atração, identificação, desenvolvimento e retenção de talentos baseadas no(a):;Existência de programas de qualidade de vida no trabalho e programas de coaching.;Até 10%;10;Até 10%;10;;;;0;;0;;;Operador de beneficiamentos têxteis;;;;;;Solução de problemas;;Força dinâmica;;;;13;;;
Têxtil;2019;Fabricação, pelas empresas, de artigos têxteis funcionais para a medicina, que incluem sistemas de liberação de drogas, de monitoramento de funções de saúde, implantes têxteis inteligentes e substratos para engenharia de tecidos vivos.;Têxteis medicinais;Até 10% do mercado;0;10;Até 10% do mercado;0;10;11 a 30% do mercado;11;30;Estratégias para atração, identificação, desenvolvimento e retenção de talentos baseadas no(a):;Existência de estrutura organizacional descentralizada,  democratização da informação.;Até 10%;10;Até 10%;10;;;;0;;0;;;Operador de beneficiamentos têxteis;;;;;;Reconhecimento de padrões;;;;;;13;;;
Automação e Mecatrônica;2017;Redes Wireless padronizadas;Redes wireless;11 a 30% do mercado;11;30;31 a 50% do mercado;31;50;;0;0;;;;0;;0;;;;0;;0;;;Tecnólogo em mecatrônica;Programar  Máquinas  CNC com CAM;;Educação e _x000D_Treinamento;;;Resolução de problemas complexos;Gestão de recursos de pessoal;Raciocínio matemático;;;;26, 27, 28;;;
Biogás;2018;Uso, pelas empresas do setor de biogás, de tecnologias para tratamento/Condicionamento de Biogás (Siloxanos);Tratamento biogás;Até 10% do mercado;0;10;Até 10% do mercado;0;10;Até 10% do mercado;0;10;Ferramentas para o processo de tomada de decisão;Ferramentas de análise de mercado;51 a 70%;70;51 a 70%;70;;;;0;;0;;;Técnico em eletromecânica com especialização em biogás;Executar pequenas instalações e adaptações nos equipamentos;;Língua Estrangeira;;;Monitoramento de operações;Gestão do tempo;Força estática;;;;19, 35;193;19322;
Metalurgia;2020;Uso, pelas empresas metalurgicas, da tecnologia de realidade aumentada.;Realidade aumentada;Até 10% do mercado;0;10;Até 10% do mercado;0;10;11 a 30% do mercado;11;30;Estratégias de comercialização baseadas no oferecimento de produtos inovadores;;Até 10%;10;11 a 30%;30;;;;0;;0;;;Caldereiro de Manutenção Industrial;Liberar o conjunto para inspeção;;Mecânica;;;Instrução;Aprendizagem ativa;Coordenação dos membros superiores e inferiores;;;;24;;;
Mineração;2020;Uso, pelas empresas de mineração, de tecnologias que usam energias renováveis na buscando uma redução da pegada ambiental.;Energias renováveis mineração;;0;0;;0;0;;0;0;;;;0;;0;;;;0;;0;;;Amostrador de minérios;Alimentar banco de dados (data bank) com informações obtidas a partir da coleta e amostragem de minérios.;;Ciência da computação;;;Matemática;Aprendizagem Estratégica;Controle e precisão;;;;07, 08;;;
Mineração;2020;Uso, pelas empresas de mineração, de veículos autônomos, em determinadas operações.;Veículos autônomos mineração;;0;0;;0;0;;0;0;;;;0;;0;;;;0;;0;;;Amostrador de minérios;Pesquisar conjuntos de dados (datasets) de amostragem de minérios a partir de um banco de dados (data bank);;Ciência da computação;;;Monitoramento de operações;Avaliação de sistemas;Criatividade/originalidade;;;;07, 08;;;
Mineração;2020;Uso, pelas empresas de mineração, de tecnologias para redução de desperdícios.;Redução desperdícios mineração;;0;0;;0;0;;0;0;;;;0;;0;;;;0;;0;;;Amostrador de minérios;Analisar dados referentes a amostragem de minérios em banco de dados;;Administração e Gestão;;;Operação e controle;Gestão de recursos de pessoal;Destreza manual;;;;07, 08;;;
Têxtil;2019;Uso, pelas empresas têxteis de fibras têxteis biomimetizadas, buscando maior rapidez de absorção, transporte de água, melhor manipulação e maior facilidade de uso e de lavagem do que uma estrutura de malha tradicional.;Fibras biomimetizadas;Até 10% do mercado;0;10;Até 10% do mercado;0;10;11 a 30% do mercado;11;30;Estratégias de  de Produção baseadas na:;Produção Enxuta (lean manufacturing);Até 10%;10;De 11 a 30%;0;;;;0;;0;;;Operador de beneficiamentos têxteis;Seguir normas e procedimentos ambientais, de higiene e segurança no trabalho pertinentes às operações.;;Engenharia e Tecnologias;;;Aprendizagem ativa;Percepção ambiental;Atenção seletiva;;;;13;;;
Eletroeletrônico;2019;Implantação, pelas empresas de eletroeletrônica, de NR 19 (Atmosfera explosiva);NR 19;11 a 30% do mercado;11;30;31 a 50% do mercado;31;50;51 a 70% do mercado;51;70;Estabelecimento de metas financeiras e não financeiras;Outros (especificar);;0;;0;;;;0;;0;;;Técnico em eletrônica;Programar sistemas embarcados;;Língua Estrangeira;;;Projetos tecnológicos;;Criatividade/originalidade;Persistência;;;26;;;
Metal Mecânica;2019;Uso, pelas empresas de metal mecânica, do processo de usinagem com Nitrogênio;Usinagem nitrogênio;Não ocorrerá difusão;0;0;Não ocorrerá difusão;0;0;Não ocorrerá difusão;0;0;Ferramentas para o processo de tomada de decisão;Ferramentas para identificação de tendências tecnológicas (prospectiva tecnológica);Até 10%;10;Até 10%;10;;;;0;;0;;;Operador de Centro de Usinagem com Comando Numérico;Preparar peça realizando a medição da matéria-prima e limpeza da “rebarbação” da peça.;;Mecânica;;;Coordenação;Fluência digital;Atenção seletiva;Multitarefa;;;24, 25, 28;;;
Biogás;2018;Adoção/adaptação de veículos de grande porte movidos a biometano;Veículos biometano;Até 10% do mercado;0;10;Até 10% do mercado;0;10;11 a 30% do mercado;11;30;Estratégias para atração, identificação, desenvolvimento e retenção de talentos baseadas no(a):;Existência de estrutura organizacional descentralizada,  democratização da informação.;Até 10%;10;Até 10%;10;;;;0;;0;;;Técnico em química com especialização em biogás;Analisar a qualidade do substrato e digestato por meio de ensaios laboratoriais;;Química;;Engenharia e tecnologias;Operação e controle;;Raciocínio abstrato;;;;19, 35;193;19322;
Biogás;2018;Desenvolvimento de equipamentos elétricos e mecânicos para motor geradores;Equipamentos elétricos;Até 10% do mercado;0;10;Até 10% do mercado;0;10;11 a 30% do mercado;11;30;Estratégias para atração, identificação, desenvolvimento e retenção de talentos baseadas no(a):;Existência de projetos e ações que permitam o comprometimento e o empowerment dos colaboradores.;Até 10%;10;Até 10%;10;;;;0;;0;;;Técnico em química com especialização em biogás;Coletar amostras de biogás e digerido;;Biologia;;Legislação e Governo;Monitoramento de operações;;Raciocínio indutivo;;;;19, 35;193;19322;
Biogás;2018;Adoção, pelas empresas do setor de biogás, de metodologias de gestão para o  monitoramento de eficiência energética;Gestão eficiência energética;Não ocorrerá difusão;0;0;Até 10% do mercado;0;10;Até 10% do mercado;0;10;Estratégias para atração, identificação, desenvolvimento e retenção de talentos baseadas no(a):;Outro (especificar);;0;;0;;;;0;;0;;;Técnico em química com especialização em biogás;Monitorar a qualidade do biogás e biometano in situ e ex situ por meio de equipamentos de medição;;Física;;Produção e Processamento;Análise de operações;;Ordenação de informações;;;;19, 35;193;19322;
Construção Civil;2018;;;;0;0;;0;0;;0;0;;;;;;;;;;;;;;;Vidraceiro;Ler projeto.;;Matemática;;Computadores e eletrônica;Matemática;;Atenção seletiva;;;;41, 42, 43;;;
Construção Civil;2018;;;;0;0;;0;0;;0;0;;;;;;;;;;;;;;;Vidraceiro;Conferir medidas no local.;;Construções;;Produção e Processamento;Compreensão de leitura;;Percepção de problemas;;;;41, 42, 43;;;
Eletroeletrônico;2019;;;;0;0;;0;0;;0;0;;;;0;;0;;;;0;;0;;;Tecnólogo em eletrônica industrial;Programar dispositivos eletrônicos (CLP, IHM, MCU, PLD);;Produção e Processamento;;Educação e Treinamento;Análise de controle de qualidade;;Raciocínio indutivo;;;;26;;;
Eletroeletrônico;2019;Implantação, pelas empresas de eletroeletrônica, de equipamentos de segurança (ex. relé de segurança, botões de emergência, bimanual).;Equipamentos segurança;11 a 30% do mercado;11;30;31 a 50% do mercado;31;50;51 a 70% do mercado;51;70;Estabelecimento de ações e programas de responsabilidade empresarial que:;Informem e eduquem seus clientes finais, quanto ao melhor uso e descarte dos produtos gerados pela cadeia;31 a 50%;50;31 a 50%;50;;;;0;;0;;;Técnico em eletrotécnica;Realizar otimização/retrofitting de instalações elétricas;;Vendas e Marketing;;Metacognição e aprendizagem autorregulada;Análise de controle de qualidade;;Visão periférica;;;;26;;;
Eletroeletrônico;2019;Implantação, pelas empresas de eletroeletrônica, de cálculo de OEE (para disponibilidade de máquinas e identificação de performance.;Cálculo OEE;Até 10% do mercado;0;10;11 a 30% do mercado;11;30;31 a 50% do mercado;31;50;Estabelecimento de ações e programas de responsabilidade empresarial que:;Racionalizem e otimizem o uso de utilidades e a  reciclagem de seus produtos após o uso;11 a 30%;30;31 a 50%;50;;;;0;;0;;;Técnico em eletrotécnica;Gerenciar equipe de trabalho distribuindo as atividades conforme a expertise de cada um;;Telecomunicações;;Metaconhecimento sobre emoções;Julgamento e tomada de decisões;;Percepção de problemas;;;;26;;;
Eletroeletrônico;2019;Implantação, pelas empresas de eletroeletrônica, da metodologias de lean manufacturing;Lean manufacturing;Até 10% do mercado;0;10;11 a 30% do mercado;11;30;31 a 50% do mercado;31;50;Estabelecimento de indicadores de desempenho;Outro (especificar);;0;;0;;;;0;;0;;;Técnico em eletrotécnica;Realizar parametrização de sistemas elétricos;;Mecânica;;Ciência de dados;Comunicação;Negociação;Expressão oral;Iniciativa;;;26;;;
Eletroeletrônico;2019;Digitalização da produção, pelas empresas de eletroeletrônica, para estabelecimento de comparativo entre o produto acabado e o originalmente concebido;Digitalização produção;Até 10% do mercado;0;10;11 a 30% do mercado;11;30;31 a 50% do mercado;31;50;Estabelecimento de ações e programas de responsabilidade empresarial que:;Permitam a contratação, capacitação e promoção grupos vulneráveis visando promover a igualdade de oportunidades;Até 10%;10;11 a 30%;30;;;;0;;0;;;Técnico em eletrotécnica;Realizar operação da manutenção de sistemas elétricos;;Produção e Processamento;;Fabricação digital;Reparos;Programação (Algoritmo);Compreensão escrita;Inovação;;;26;;;
Eletroeletrônico;2019;Uso, pelas empresas de eletroeletrônica, de tecnologias de inspeção ótica com equipamentos especializados como placas de circuitos impressos (montagem SMT);Inspeção ótica;Até 10% do mercado;0;10;11 a 30% do mercado;11;30;31 a 50% do mercado;31;50;Estabelecimento de ações e programas de responsabilidade empresarial que:;Assegurem aos trabalhadores uma remuneração que garanta um nível de vida adequado a eles e a suas famílias;11 a 30%;30;11 a 30%;30;;;;0;;0;;;Técnico em eletrotécnica;Realizar gestão da manutenção de sistemas elétricos;;Psicologia;;Geotecnologia;Solução de problemas;;Coordenação dos membros superiores e inferiores;Persistência;;;26;;;
Eletroeletrônico;2019;Uso, pelas empresas de eletroeletrônica, de sistemas automatizados para detecção de falhas no processo ou produto;Detecção falhas automatizada;Até 10% do mercado;0;10;11 a 30% do mercado;11;30;31 a 50% do mercado;31;50;Estabelecimento de ações e programas de responsabilidade empresarial que:;Minimizem os riscos à saúde e segurança do consumidor ou cliente de seus produtos e serviços;31 a 50%;50;31 a 50%;50;;;;0;;0;;;Técnico em eletrotécnica;Realizar relatórios técnicos funcional de equipamentos e instalações;;Serviços;;Metacognição e aprendizagem autorregulada;Manutenção de equipamentos;;Coordenação corporal;;;;26;;;
Energias Renováveis;2018;Implantação de sistemas fotovoltaicos baseados células concentradoras de energia solar;Células concentradoras solares;Não ocorrerá difusão;0;0;Não ocorrerá difusão;0;0;;0;0;;;;0;;0;;;;0;;0;;;Técnico em energias renováveis;Desenvolver projetos de gestão de energia e eficiência energética;;Computadores, Eletrônica e automação;;Serviços;Gestão de recursos de materiais;;;;;Autocontrole;35;;;
Logística;2020;;;;0;0;;0;0;;0;0;;;;0;;0;;;;0;;0;;;Técnico Especializado em Logística 4.0;;;;;Curva ABC, GUT, matriz de priorização;;;;;;;49, 50, 51, 52;493, 494, 501;50114, 50122;5011401, 5012201
Logística;2020;;;;0;0;;0;0;;0;0;Estabelecimento de indicadores de desempenho:;Mensurados por ferramentas de TI;Até 10%;10;31 a 50%;50;;;;0;;0;;;Operador de Logística Portuária;Analisar riscos e consequências na movimentação e no transporte de cargas utilizando Robôs Colaborativos e veículos aéreos não tripulados.;;Ciência da computação;;Linguagem de programação/algoritmo;;Pensamento crítico;;Categorização;;;49, 50, 51, 52;493, 494, 501;50114, 50122;5011401, 5012201
Logística;2020;;;;0;0;;0;0;;0;0;Estabelecimento de ações e programas de responsabilidade empresarial que:;Informem e eduquem seus clientes finais, quanto ao melhor uso e descarte dos produtos gerados pela cadeia;Até 10%;10;Até 10%;10;;;;0;;0;;;Operador de Logística Portuária;;;;;Manufacturing analytics;;Análise de controle de qualidade;;Flexibilidade Cognitiva;;;49, 50, 51, 52;493, 494, 501;50114, 50122;5011401, 5012201
Logística;2020;;;;0;0;;0;0;;0;0;Estabelecimento de ações e programas de responsabilidade empresarial que:;Incentivem e remunerem, por meio de processos sistemáticos, seus funcionários a inovar;Nenhuma empresa da cadeia produtiva irá implementar;0;Até 10%;10;;;;0;;0;;;Operador de Logística Portuária;;;;;Internet Industrial das Coisas;;Solução de problemas;;Orientação a resultados;;;49, 50, 51, 52;493, 494, 501;50114, 50122;5011401, 5012201
Logística;2020;;;;0;0;;0;0;;0;0;;;;0;;0;;;;0;;0;;;Técnico em Logística;Analisar relatórios de controle operacional logístico (Recebimento, Movimentação e Expedição);;Administração e Gestão;;"Gestão de Custos; Gestão Estratégica; Gestão de Pessoas; Gestão de Qualidade e Processos; Gestão de Projetos";Aprendizagem ativa;;Multitarefa;Adaptabilidade / Flexibilidade;;Inovação;49, 50, 51, 52;493, 494, 501;50114, 50122;5011401, 5012201
Logística;2020;;;;0;0;;0;0;;0;0;;;;0;;0;;;;0;;0;;;Técnico em Logística;Apoiar na estratificação dos indicadores, análise das causas e construção das ações de melhoria;;Administrativos;;"Organização de Arquivos; Teoria Geral da Informação; Classificação de Documentos; Processo de Aquisição de Materiais; Técnicas de Recuperação de Informação; Processos de Disseminação da Informação; Organização e Métodos";Aprendizagem estratégica;;Ordenação de informações;Autocontrole;;Liderança;49, 50, 51, 52;493, 494, 501;50114, 50122;5011401, 5012201
Logística;2020;;;;0;0;;0;0;;0;0;;;;0;;0;;;;0;;0;;;Técnico em Logística;Calcular os custos do processo (objetivando sua redução);;Engenharia e Tecnologias;;Aplicação prática da ciência da engenharia e de tecnologias. Envolve os princípios técnicas, procedimentos e equipamentos para o projeto e a produção de bens e serviços.;Ciências;;Orientação a resultados;Compreensão escrita;;;49, 50, 51, 52;493, 494, 501;50114, 50122;5011401, 5012201
Logística;2020;;;;0;0;;0;0;;0;0;;;;0;;0;;;;0;;0;;;Técnico em Logística;Conhecer e implantar a Logística Reversa com foco na sustentabilidade;;Legislação e Governo;;"Normas Técnicas; Administração Pública; Organizações Internacionais; Instituições Governamentais Específicas; Direito Ambiental";Compreensão de leitura;;Percepção de problemas;Controle de precisão;;;49, 50, 51, 52;493, 494, 501;50114, 50122;5011401, 5012201
Logística;2020;;;;0;0;;0;0;;0;0;;;;0;;0;;;;0;;0;;;Técnico em Logística;Elaborar cálculos estatísticos com foco no processo logístico (análise de dados);;Língua Estrangeira;;Estrutura e conteúdo de uma língua inglesa, incluindo o significado e a grafia de palavras, regras de composição e gramática.;Comunicação;;Raciocínio dedutivo;Cooperação;;;49, 50, 51, 52;493, 494, 501;50114, 50122;5011401, 5012201
Logística;2020;;;;0;0;;0;0;;0;0;;;;0;;0;;;;0;;0;;;Técnico em Logística;Elaborar política da qualidade (melhoria contínua);;Língua Portuguesa;;"Leitura e Interpretação de Textos; Redação; Ortografia; Gramática da Língua Portuguesa";Coordenação;;Raciocínio numérico;Criatividade;;;49, 50, 51, 52;493, 494, 501;50114, 50122;5011401, 5012201
Logística;2020;;;;0;0;;0;0;;0;0;;;;0;;0;;;;0;;0;;;Técnico em Logística;Implementar política da qualidade (melhoria contínua);;Produção e Processamento;;"Planejamento, Projeto e Controle de Sistemas de Produção; Planejamento de Instalações Industriais; Gerência de Produção; Processos de Fabricação.";Escuta ativa;;Velocidade de organização e resposta;Flexibilidade Cognitiva;;;49, 50, 51, 52;493, 494, 501;50114, 50122;5011401, 5012201
Logística;2020;;;;0;0;;0;0;;0;0;;;;0;;0;;;;0;;0;;;Técnico em Logística;Elaborar indicadores (KPI e/ou KPA) de desempenho com foco em resultados;;Vendas e Marketing;;"Marketing de Serviços; Qualidade em Serviços; Negociação; Gestão de Serviços.";Gestão de recursos de pessoal;;;Fluência de ideias;;;49, 50, 51, 52;493, 494, 501;50114, 50122;5011401, 5012201
Logística;2020;;;;0;0;;0;0;;0;0;;;;0;;0;;;;0;;0;;;Técnico em Logística;Gerar documentações fiscais e de controle interno operacional;;Transportes;;"Planejamento e Organização de Sistemas de Transportes; Operação de Sistemas de Transportes; Veículos e Equipamentos de Controle; Logística de Transportes; Infraestrutura de Transportes.";Gestão de recursos financeiros;;;Iniciativa;;;49, 50, 51, 52;493, 494, 501;50114, 50122;5011401, 5012201
Logística;2020;;;;0;0;;0;0;;0;0;;;;0;;0;;;;0;;0;;;Técnico em Logística;Gerar informações proveniente de ocorrências na execução dos processos operacionais logísticos;;Psicologia;;"Noções de Psicologia do Trabalho e Organizacional; Relações Interpessoais; Processos Grupais e de Comunicação";Matemática;;;Inovação;;;49, 50, 51, 52;493, 494, 501;50114, 50122;5011401, 5012201
Logística;2020;;;;0;0;;0;0;;0;0;;;;0;;0;;;;0;;0;;;Técnico em Logística;Gerenciar pessoas e processos em logística;;Construções;;Construções (foco planejamento de novos armazéns/layout);Monitoramento de operações;;;Liderança;;;49, 50, 51, 52;493, 494, 501;50114, 50122;5011401, 5012201
Logística;2020;;;;0;0;;0;0;;0;0;;;;0;;0;;;;0;;0;;;Técnico em Logística;Gerenciar serviços ao Cliente (foco em: Qualidade, Custos, Delivery/Nível de serviço);;Matemática;;"Probabilidade e Estatística; Cálculo e Análise; Lógica Matemática";Operação e controle;;;;;;49, 50, 51, 52;493, 494, 501;50114, 50122;5011401, 5012201
Logística;2020;;;;0;0;;0;0;;0;0;;;;0;;0;;;;0;;0;;;Técnico em Logística;Monitorar a execução dos processos operacionais, garantindo seu cumprimento;;Contabilidade e Economia;;"Noções de Ciências Contábeis; Microeconomia; Macroeconomia; Estudo de Viabilidade de Projetos;";Orientação a serviços;;;;;;49, 50, 51, 52;493, 494, 501;50114, 50122;5011401, 5012201
Logística;2020;Uso, pelas empresas industriais e suas áreas de logística, da internet industrial das coisas (IIoT) para controle da produção e para a área de logística;IIoT produção/logística;Até 10% do mercado;0;10;11 a 30% do mercado;11;30;;0;0;Estratégias de posicionamento no mercado baseadas em:;Liderança por diferenciação;Até 10%;10;11 a 30%;30;;;;0;;0;;;Controlador e Programador da Produção;Explorar dados (estatísticos e algoritmos);;Ciência da computação;;Linguagem de programação/algoritmo;;Analise de operações;;Adaptabilidade / Flexibilidade;;;49, 50, 51, 52;493, 494, 501;50114, 50122;5011401, 5012201
