NM_SETOR_TEMA;NR_ANO;NM_TECNOLOGIAS;NM_TEC_RESUM;DS_DIFUSAO_TECNOLOGICA_5ANOS;NR_DIFUSAO_TECNOLOGICA_5ANOS_INICIO;NR_DIFUSAO_TECNOLOGICA_5ANOS_FIM;DS_DIFUSAO_TECNOLOGICA_10ANOS;NR_DIFUSAO_TECNOLOGICA_10ANOS_INICIO;NR_DIFUSAO_TECNOLOGICA_10ANOS_FIM;DS_DIFUSAO_TECNOLOGICA_15ANOS;NR_DIFUSAO_TECNOLOGICA_15ANOS_INICIO;NR_DIFUSAO_TECNOLOGICA_15ANOS_FIM;NM_FT_ORGANIZACIONAL;DS_FT_ORGANIZACIONAL;DS_EMP_IMPACTADAS_5ANOS;PC_EMP_IMPACTADAS_5ANOS;DS_EMP_IMPACTADAS_10ANOS;PC_EMP_IMPACTADAS_10ANOS;NM_NV_OCUP;DS_NV_OCUP;DS_DEMANDA_EMP_5ANOS;NR_DEMANDA_EMP_5ANOS;DS_DEMANDA_EMP_10ANOS;NR_DEMANDA_EMP_10ANOS;NM_CONHEC_NV_OCUP;NM_HAB_NV_OCUP;NM_OCUP;NM_ATIV;NM_NOVAS_ATIV;NM_CONHEC;NM_CONHEC_DETALHADOS;NM_NV_CONHEC;NM_HABIL;NM_NV_HABIL;NM_CAPAC;NM_NV_CAPAC;NM_OUTRAS_OCUP;NM_ESTILOS_TRABALHO;CD_CNAE20_DIV;CD_CNAE20_GRUPO;CD_CNAE20_CLASSE;CD_CNAE23_SUBCLASSE
Alimentos e Bebidas;2022;Crescimento do uso de embalagens com alta barreira em atmosfera modificada ou controlada;Embalagens alta barreira;;0;0;;0;0;;0;0;;;;;;;;;;;;;;;Padeiro;Operar a linha de produção de pães com fermentação natural conhecendo todas as etapas do fluxograma e seus impactos na qualidade do produto final.;;;;;;;;;;;10, 11;;;
Alimentos e Bebidas;2022;Desenvolvimento e consumo de bebidas sem álcool com adaptógenos e nootrópicos que “imitam” cerveja;Bebidas adaptógenas/nootrópicas;;0;0;;0;0;;0;0;;;;;;;;;;;;;;;Padeiro;Avaliar a qualidade sensorial dos produtos,  propondo os ajustes necessários no processo de fabricação dos pães com fermentação natural quando necessário.;;;;;;;;;;;10, 11;;;
Alimentos e Bebidas;2022;Desenvolvimento de destilados não alcoólicos de canabidiol;Destilados canabidiol;;0;0;;0;0;;0;0;;;;;;;;;;;;;;;Padeiro;Utilizar a tecnologia do frio para bloquear o processo de fermentação dos pães (armazenamento).;;;;;;;;;;;10, 11;;;
Alimentos e Bebidas;2022;Desenvolvimento e consumo de cervejas sem glúten;Cervejas sem glúten;;0;0;;0;0;;0;0;;;;;;;;;;;;;;;Padeiro;Monitorar e controlar a cadeia do frio em todas as etapas do seu processo: armazenamento, descongelamento, finalização, assamento, embalagem e expedição, de acordo com a ficha técnica do produto e a realidade do processo produtivo.;;;;;;;;;;;10, 11;;;
Alimentos e Bebidas;2022;Desenvolvimento e consumo de bebidas com formulação à base de plantas;Bebidas vegetais;;0;0;;0;0;;0;0;;;;;;;;;;;;;;;Padeiro;Realizar testes e inspeções dos produtos elaborados para avaliar a qualidade sensorial dos pães.;;;;;;;;;;;10, 11;;;
Alimentos e Bebidas;2022;Crescimento do consumo de bebidas com redução de açúcar e uso de edulcorantes;Bebidas reduzidas em açúcar;;0;0;;0;0;;0;0;;;;;;;;;;;;;;;Padeiro;Identificar as causas de erros ou falhas no processo que impactaram na qualidade final do produto, propondo e aplicando soluções de melhoria.;;;;;;;;;;;10, 11;;;
Alimentos e Bebidas;2022;Crescimentod a produção de Multiprocessados/ultraprocessados. (Colocar este conceito nas etapas de formação profissional);Multiprocessados;;0;0;;0;0;;0;0;;;;;;;;;;;;;;;Padeiro;Utilizar aditivos e coadjuvantes de tecnologia;;;;;;;;;;;10, 11;;;
Alimentos e Bebidas;2022;Desenvolvimento e consumo de gorduras mais saudáveis;Gorduras saudáveis;;0;0;;0;0;;0;0;;;;;;;;;;;;;;;Operador de processamento de bebidas;Realizar análises rápidas de controle de qualidade para diferentes etapas do fluxo produtivo;;;;;Reparos;;;;;;10, 11;;;
Alimentos e Bebidas;2022;Uso de dispositivos habilitados para Internet das Coisas com o propósito de compartilhamento de dados nutricionais pessoais dos consumidores;IoT nutricional;;0;0;;0;0;;0;0;;;;;;;;;;;;;;;Operador de processamento de bebidas;Coletar e preparar amostras para análise;;;;;Solução de problemas;;;;;;10, 11;;;
Automação e Mecatrônica;2017;Sistemas integrados de engenharia para desenvolvimento de produtos e manufatura de produtos;Engenharia integrada;Até 10% do mercado;0;10;11 a 30% do mercado;11;30;;0;0;;;;0;;0;;;;0;;0;;;Tecnólogo em automação industrial;Realizar  Manutenção em Sistemas de Automação;;Língua Estrangeira;;;Projetos tecnológicos;;Atenção seletiva;;;;26, 27, 28;;;
Automação e Mecatrônica;2017;Utilização de serviços em nuvem associados ao produto;Serviços em nuvem;Até 10% do mercado;0;10;11 a 30% do mercado;11;30;;0;0;;;;0;;0;;;;0;;0;;;Tecnólogo em automação industrial;Realizar  Diagnósticos em Sistemas de Automação;;Design;;;Gestão do tempo;;Compreensão escrita;;;;26, 27, 28;;;
Automação e Mecatrônica;2017;Visão robótica aplicada;Visão robótica;Até 10% do mercado;0;10;11 a 30% do mercado;11;30;;0;0;;;;0;;0;;;;0;;0;;;Tecnólogo em automação industrial;;;Física;;;Solução de problemas;;Expressão oral;;;;26, 27, 28;;;
Automação e Mecatrônica;2017;Web semantic;Web semântica;Até 10% do mercado;0;10;11 a 30% do mercado;11;30;;0;0;;;;0;;0;;;;0;;0;;;Tecnólogo em automação industrial;;;;;;Análise de sistemas;;Multitarefa;;;;26, 27, 28;;;
Automação e Mecatrônica;2017;Sistemas de Telemetria;Telemetria;11 a 30% do mercado;11;30;31 a 50% do mercado;31;50;;0;0;;;;0;;0;;;;0;;0;;;Tecnólogo em mecatrônica;Projetar células robóticas;;Legislação e Governo;;;Manutenção de equipamentos;;Ordenação de informações;;;;26, 27, 28;;;
Automação e Mecatrônica;2017;"Wireless Sensor Networks (WSN);";WSN;11 a 30% do mercado;11;30;31 a 50% do mercado;31;50;;0;0;;;;0;;0;;;;0;;0;;;Tecnólogo em mecatrônica;Projetar  sistemas hidráulicos e pneumáticos;;Matemática;;;Instalação;;Flexibilidade para categorização;;;;26, 27, 28;;;
Automação e Mecatrônica;2017;Dispositivos de Visão;Dispositivos de visão;11 a 30% do mercado;11;30;31 a 50% do mercado;31;50;;0;0;;;;0;;0;;;;0;;0;;;Tecnólogo em mecatrônica;Projetar  sistemas de comandos elétricos;;Mecânica;;;Programação;;Atenção seletiva;;;;26, 27, 28;;;
Automação e Mecatrônica;2017;Sistemas de Prototipagem Virtual para Projeto;Prototipagem virtual;11 a 30% do mercado;11;30;31 a 50% do mercado;31;50;;0;0;;;;0;;0;;;;0;;0;;;Tecnólogo em mecatrônica;Parametrizar redes industriais;;Produção e Processamento;;;Projetos tecnológicos;;Expressão escrita;;;;26, 27, 28;;;
Automação e Mecatrônica;2017;Incorporação de serviços digitais nos produtos (“Internet das Coisas” ou Product Service Systems);IoT em produtos;11 a 30% do mercado;11;30;31 a 50% do mercado;31;50;;0;0;;;;0;;0;;;;0;;0;;;Tecnólogo em mecatrônica;Programar sistemas supervisórios;;Psicologia;;;Análise de sistemas;;Percepção de profundidade;;;;26, 27, 28;;;
Automação e Mecatrônica;2017;Manufatura aditiva, prototipagem rápida ou impressão 3D;Manufatura aditiva;11 a 30% do mercado;11;30;31 a 50% do mercado;31;50;;0;0;;;;0;;0;;;;0;;0;;;Tecnólogo em mecatrônica;Empregar metrologia na fabricação de dispositivos;;Língua Estrangeira;;;Gestão do tempo;;;;;;26, 27, 28;;;
Automação e Mecatrônica;2017;Monitoramento de operações e controle remoto da produção com sistemas do tipo MES e SCADA;Monitoramento remoto;11 a 30% do mercado;11;30;31 a 50% do mercado;31;50;;0;0;;;;0;;0;;;;0;;0;;;;;;;;;;;;;;;26, 27, 28;;;
Automação e Mecatrônica;2017;Redes industriais baseadas em Ethernet;Redes industriais Ethernet;11 a 30% do mercado;11;30;51 a 70% do mercado;51;70;;0;0;;;;0;;0;;;;0;;0;;;;;;;;;;;;;;;26, 27, 28;;;
Automação e Mecatrônica;2017;RFID e sua integração nos sistemas sensoriais;RFID;31 a 50% do mercado;31;50;51 a 70% do mercado;51;70;;0;0;;;;0;;0;;;;0;;0;;;;;;;;;;;;;;;26, 27, 28;;;
Automação e Mecatrônica;2017;Projetos de manufatura por computador CAD/CAM;CAD/CAM;31 a 50% do mercado;31;50;51 a 70% do mercado;51;70;;0;0;;;;0;;0;;;;0;;0;;;;;;;;;;;;;;;26, 27, 28;;;
Automação e Mecatrônica;2017;Simulações/análise de modelos virtuais (Elementos Finitos, Fluidodinâmica Computacional, etc.) para projeto e comissionamento;Simulações virtuais;31 a 50% do mercado;31;50;51 a 70% do mercado;51;70;;0;0;;;;0;;0;;;;0;;0;;;;;;;;;;;;;;;26, 27, 28;;;
Automação e Mecatrônica;2017;Sistemas especialistas (Lógica Fuzzy e neuro Fuzzy);Sistemas especialistas;Até 10% do mercado;0;10;Até 10% do mercado;0;10;;0;0;;;;0;;0;;;;0;;0;;;;;;;;;;;;;;;26, 27, 28;;;
Automação e Mecatrônica;2017;Sistemas EDDL/FDT-DTM/FDI para criação de linguagem de conversão;Conversão linguagem;Até 10% do mercado;0;10;Até 10% do mercado;0;10;;0;0;;;;0;;0;;;;0;;0;;;;;;;;;;;;;;;26, 27, 28;;;
Automação e Mecatrônica;2017;Sistemas especialistas como ferramenta de suporte a decisão e IA (controle automático);IA em automação;Até 10% do mercado;0;10;Até 10% do mercado;0;10;;0;0;;;;0;;0;;;;0;;0;;;;;;;;;;;;;;;26, 27, 28;;;
Automação e Mecatrônica;2017;Automação digital sem sensores;Automação sem sensores;Até 10% do mercado;0;10;Até 10% do mercado;0;10;;0;0;;;;0;;0;;;;0;;0;;;;;;;;;;;;;;;26, 27, 28;;;
Automação e Mecatrônica;2017;Robótica colaborativa;Robótica colaborativa;Não ocorrerá difusão;0;0;Até 10% do mercado;0;10;;0;0;;;;0;;0;;;;0;;0;;;;;;;;;;;;;;;26, 27, 28;;;
Automação e Mecatrônica;2023;;;;0;0;;0;0;;0;0;;;;;;;;;;;;;;;Técnico em Automação Industrial;;;;;;Gestão de recursos de pessoal;;Visão periférica;;;;26, 27, 28;;;
Automação e Mecatrônica;2023;;;;0;0;;0;0;;0;0;;;;;;;;;;;;;;;Técnico em Automação Industrial;;;;;;Gestão de recursos financeiros;;Clareza de expressão;;;;26, 27, 28;;;
Automação e Mecatrônica;2023;;;;0;0;;0;0;;0;0;;;;;;;;;;;;;;;Técnico em Automação Industrial;;;;;;Gestão de recursos de materiais;;;;;;26, 27, 28;;;
Automação e Mecatrônica;2023;;;;0;0;;0;0;;0;0;;;;;;;;;;;;;;;Técnico em Automação Industrial;;;;;;Gestão do tempo;;;;;;26, 27, 28;;;
Automação e Mecatrônica;2023;;;;0;0;;0;0;;0;0;;;;;;;;;;;;;;;Técnico em Mecatrônica;;;;;;Instalação;;Controle de tempo de resposta;;;;26, 27, 28;;;
Automação e Mecatrônica;2023;;;;0;0;;0;0;;0;0;;;;;;;;;;;;;;;Técnico em Mecatrônica;;;;;;Programação;;;;;;26, 27, 28;;;
Automação e Mecatrônica;2023;;;;0;0;;0;0;;0;0;;;;;;;;;;;;;;;Técnico em Mecatrônica;;;;;;Projetos tecnológicos;;;;;;26, 27, 28;;;
Automação e Mecatrônica;2023;;;;0;0;;0;0;;0;0;;;;;;;;;;;;;;;Técnico em Mecatrônica;;;;;;Análise de sistemas;;;;;;26, 27, 28;;;
Automação e Mecatrônica;2023;;;;0;0;;0;0;;0;0;;;;;;;;;;;;;;;Técnico em Mecatrônica;;;;;;Gestão de recursos materiais;;;;;;26, 27, 28;;;
Automação e Mecatrônica;2023;;;;0;0;;0;0;;0;0;;;;;;;;;;;;;;;Técnico em Mecatrônica;;;;;;Gestão do tempo;;;;;;26, 27, 28;;;
Automação e Mecatrônica;2023;;;;0;0;;0;0;;0;0;;;;;;;;;;;;;;;Robotista ou Operador de Sistemas robóticos;;;;;;Projetos tecnológicos;;Raciocínio abdutivo;;;;26, 27, 28;;;
Automação e Mecatrônica;2023;;;;0;0;;0;0;;0;0;;;;;;;;;;;;;;;Robotista ou Operador de Sistemas robóticos;;;;;;Manutenção de equipamentos;;Raciocínio matemático;;;;26, 27, 28;;;
Automação e Mecatrônica;2023;;;;0;0;;0;0;;0;0;;;;;;;;;;;;;;;Robotista ou Operador de Sistemas robóticos;;;;;;Programação;;Velocidade de organização e resposta;;;;26, 27, 28;;;
Automação e Mecatrônica;2023;;;;0;0;;0;0;;0;0;;;;;;;;;;;;;;;Robotista ou Operador de Sistemas robóticos;;;;;;Análise de sistemas;;Visualização;;;;26, 27, 28;;;
Automação e Mecatrônica;2023;;;;0;0;;0;0;;0;0;;;;;;;;;;;;;;;Robotista ou Operador de Sistemas robóticos;;;;;;Avaliação de sistemas;;Controle e precisão;;;;26, 27, 28;;;
Automação e Mecatrônica;2023;;;;0;0;;0;0;;0;0;;;;;;;;;;;;;;;Robotista ou Operador de Sistemas robóticos;;;;;;Gestão do tempo;;Destreza manual;;;;26, 27, 28;;;
Automação e Mecatrônica;2023;;;;0;0;;0;0;;0;0;;;;;;;;;;;;;;;Técnico em Instrumentação Industrial;;;;;;Gestão de recursos materiais;;Visualização;;;;26, 27, 28;;;
Automação e Mecatrônica;2023;;;;0;0;;0;0;;0;0;;;;;;;;;;;;;;;Técnico em Instrumentação Industrial;;;;;;Gestão do tempo;;Raciocínio dedutivo;;;;26, 27, 28;;;
Automação e Mecatrônica;2023;;;;0;0;;0;0;;0;0;;;;;;;;;;;;;;;Técnico em Instrumentação Industrial;;;;;;Análise de sistemas;;;;;;26, 27, 28;;;
Automação e Mecatrônica;2023;;;;0;0;;0;0;;0;0;;;;;;;;;;;;;;;Técnico em Instrumentação Industrial;;;;;;Monitoramento de operações;;;;;;26, 27, 28;;;
Automação e Mecatrônica;2023;;;;0;0;;0;0;;0;0;;;;;;;;;;;;;;;Técnico em Instrumentação Industrial;;;;;;Programação;;;;;;26, 27, 28;;;
Automação e Mecatrônica;2023;;;;0;0;;0;0;;0;0;;;;;;;;;;;;;;;Técnico em Instrumentação Industrial;;;;;;Projetos tecnológicos;;;;;;26, 27, 28;;;
Automotivo;2019;Tintas e produtos para tratamento de superfície de vidro e controle de translucidez;Tratamento vidro;Até 10% do mercado;0;10;11 a 30% do mercado;11;30;;0;0;;;;0;;0;;;;0;;0;;;Técnico em Conectividade Veicular;Configurar dispositivos móveis (externos);;Língua Estrangeira;;;Avaliação de sistemas;;Velocidade perceptiva;;;;29;;;
Automotivo;2019;Produtos a base de biomassa para estofados;Biomassa estofados;Até 10% do mercado;0;10;11 a 30% do mercado;11;30;;0;0;;;;0;;0;;;;0;;0;;;Técnico em Conectividade Veicular;Diagnosticar rede CAN (multiplex);;;;;Aprendizagem estratégica;;Raciocínio abstrato;;;;29;;;
Automotivo;2019;Novos materiais poliméricos para carroceria;Polímeros carroceria;31 a 50% do mercado;31;50;51 a 70% do mercado;51;70;;0;0;;;;0;;0;;;;0;;0;;;Técnico de energias para o setor automotivo;Instalar sistemas de geração de energias;;Computadores, Eletrônica e automação;;;Pensamento crítico;;Ordenação de informações;;;;29;;;
Automotivo;2019;Plásticos biodegradáveis;Plásticos biodegradáveis;31 a 50% do mercado;31;50;51 a 70% do mercado;51;70;;0;0;;;;0;;0;;;;0;;0;;;Técnico de energias para o setor automotivo;Instalar sistemas de recargas de veícilos elétricos.;;Construções;;;Aprendizagem ativa;;Compreensão oral;;;;29;;;
Automotivo;2019;Materiais cerâmicos;Materiais cerâmicos;Até 10% do mercado;0;10;11 a 30% do mercado;11;30;;0;0;;;;0;;0;;;;0;;0;;;Técnico de energias para o setor automotivo;Interpletar  projetos elétricos;;Administração e Gestão;;;Matemática;;Raciocínio numérico;;;;29;;;
Automotivo;2019;Scanner de diagnostico com novas formas de comunicação (ex: via smartphone, tablet, nuvem);Diagnóstico móvel;31 a 50% do mercado;31;50;51 a 70% do mercado;51;70;;0;0;;;;0;;0;;;;0;;0;;;Técnico em Conectividade Veicular;Diagnosticar conectividade veicular;;Administração e Gestão;;;Aprendizagem ativa;;Multitarefa;;;;29;;;
Automotivo;2019;Google glass como referencia e informação técnica;Google Glass;Até 10% do mercado;0;10;Até 10% do mercado;0;10;;0;0;;;;0;;0;;;;0;;0;;;Técnico em Conectividade Veicular;Reparar conectividade veicular;;Computadores, Eletrônica e automação;;;Escuta ativa;;Pensamento crítico;;;;29;;;
Automotivo;2019;Pintura a base d´agua.;Pintura à base d'água;31 a 50% do mercado;31;50;51 a 70% do mercado;51;70;;0;0;;;;0;;0;;;;0;;0;;;Técnico em Conectividade Veicular;Atualizar softwares dos sistemas;;Produção e Processamento;;;Manutenção de equipamentos;;Ordenação de informações;;;;29;;;
Automotivo;2019;Interação com o condutor para  manutenção preventiva periódica;Manutenção preventiva;31 a 50% do mercado;31;50;51 a 70% do mercado;51;70;;0;0;;;;0;;0;;;;0;;0;;;Técnico em Conectividade Veicular;Calibrar sensores e atuadores;;Telecomunicações;;;Instalação;;Raciocínio numérico;;;;29;;;
Automotivo;2019;Novas tecnologias de sistemas de transmissão. (Automática, automatizada, CVT, dupla embreagem, etc..);Transmissão avançada;51 a 70% do mercado;51;70;51 a 70% do mercado;51;70;;0;0;;;;0;;0;;;;0;;0;;;Técnico de energias para o setor automotivo;;;Língua Estrangeira;;;Operação e controle;;;;;;29;;;
Automotivo;2019;Sistema de navegação com racionalização de rotas.;Navegação otimizada;51 a 70% do mercado;51;70;51 a 70% do mercado;51;70;;0;0;;;;0;;0;;;;0;;0;;;Técnico de energias para o setor automotivo;;;Transportes;;;Monitoramento de operações;;;;;;29;;;
Automotivo;2019;Componentes de controle eletrônico (ex: estabilidade, tração e etc.);Controle eletrônico;51 a 70% do mercado;51;70;51 a 70% do mercado;51;70;;0;0;;;;0;;0;;;;0;;0;;;Técnico de energias para o setor automotivo;;;Meio ambiente;;;Análise de operações;;;;;;29;;;
Automotivo;2019;Aços especiais, ligas leves de titânio ou magnésio e alumínio de maior resistência.;Ligas leves;11 a 30% do mercado;11;30;31 a 50% do mercado;31;50;;0;0;;;;0;;0;;;;0;;0;;;Técnico de energias para o setor automotivo;;;;;;Análise de controle de qualidade;;;;;;29;;;
Automotivo;2019;Tecnologias para conexão entre todos os acessórios de forma sistêmica;Conexão sistêmica;31 a 50% do mercado;31;50;51 a 70% do mercado;51;70;;0;0;;;;0;;0;;;;0;;0;;;Técnico de energias para o setor automotivo;;;;;;Programação;;;;;;29;;;
Automotivo;2019;Pneus reservas com menos peso.;Pneus leves;Até 10% do mercado;0;10;11 a 30% do mercado;11;30;;0;0;;;;0;;0;;;;0;;0;;;Técnico de energias para o setor automotivo;;;;;;Reparos;;;;;;29;;;
Automotivo;2019;Sistema de pós tratamento de gases do escape. (linha Diesel).;Tratamento gases;51 a 70% do mercado;51;70;51 a 70% do mercado;51;70;;0;0;;;;0;;0;;;;0;;0;;;Técnico de energias para o setor automotivo;;;;;;Projetos tecnológicos;;;;;;29;;;
Automotivo;2019;Sistema de sinalização de emergência em situações de pânico (ex: diferenciação de níveis de frenagem);Sinalização emergência;11 a 30% do mercado;11;30;31 a 50% do mercado;31;50;;0;0;;;;0;;0;;;;0;;0;;;Técnico de energias para o setor automotivo;;;;;;Solução de problemas;;;;;;29;;;
Automotivo;2019;Processo de logística reversa para produtos de agressão aos mananciais (resíduos de óleos e combustíveis, baterias, embalagens, tintas e vernizes etc);Logística reversa mananciais;51 a 70% do mercado;51;70;51 a 70% do mercado;51;70;;0;0;;;;0;;0;;;;0;;0;;;Técnico de energias para o setor automotivo;;;;;;Análise de sistemas;;;;;;29;;;
Automotivo;2019;Processo de logística reversa para outros produtos (pneus, material de frenagem, peças contaminadas - filtros, juntas etc);Logística reversa produtos;51 a 70% do mercado;51;70;51 a 70% do mercado;51;70;;0;0;;;;0;;0;;;;0;;0;;;Técnico de energias para o setor automotivo;;;;;;Gestão do tempo;;;;;;29;;;
Automotivo;2019;Processos compartilhados de logística e estoque (redes).;Logística compartilhada;31 a 50% do mercado;31;50;51 a 70% do mercado;51;70;;0;0;;;;0;;0;;;;0;;0;;;Técnico de energias para o setor automotivo;;;;;;Fluência digital;;;;;;29;;;
Automotivo;2023;;;;0;0;;0;0;;0;0;;;;;;;;;;;;;;;Tecnólogo em sistemas automotivos;;;;;;Fluência digital;;Destreza manual;;;;29;;;
Automotivo;2023;;;;0;0;;0;0;;0;0;;;;;;;;;;;;;;;Tecnólogo em sistemas automotivos;;;;;;Instalação;;Controle de tempo de resposta;;;;29;;;
Automotivo;2023;;;;0;0;;0;0;;0;0;;;;;;;;;;;;;;;Tecnólogo em sistemas automotivos;;;;;;Programação;;Atenção auditiva;;;;29;;;
Automotivo;2023;;;;0;0;;0;0;;0;0;;;;;;;;;;;;;;;Tecnólogo em sistemas automotivos;;;;;;Solução de problemas;;Clareza de expressão;;;;29;;;
Automotivo;2023;;;;0;0;;0;0;;0;0;;;;;;;;;;;;;;;Tecnólogo em sistemas automotivos;;;;;;;;Flexibilidade dinâmica;;;;29;;;
Automotivo;2023;;;;0;0;;0;0;;0;0;;;;;;;;;;;;;;;Tecnólogo em sistemas automotivos;;;;;;;;Coordenação corporal;;;;29;;;
Automotivo;2023;;;;0;0;;0;0;;0;0;;;;;;;;;;;;;;;Mecânico de veículos leves;;;;;;Julgamento e tomada de decisões;;;;;;29;;;
Automotivo;2023;;;;0;0;;0;0;;0;0;;;;;;;;;;;;;;;Mecânico de veículos leves;;;;;;Gestão do tempo;;;;;;29;;;
Automotivo;2019;Células de baterias Li-Po (Polímero de Lítio);Baterias Li-Po;31 a 50% do mercado;31;50;51 a 70% do mercado;51;70;;0;0;;;;0;;0;;;;0;;0;;;Técnico de energias para o setor automotivo;Configurar sistemas off grid  e on grid;;Engenharia e Tecnologias;;;Compreensão de leitura;;Percepção de problemas;;;;29;;;
Automotivo;2019;Sistemas de injeção direta de combustível;Injeção direta;31 a 50% do mercado;31;50;51 a 70% do mercado;51;70;;0;0;;;;0;;0;;;;0;;0;;;Técnico de energias para o setor automotivo;Diagnosticar falhas em sistemas de recargas.;;Física;;;Comunicação;;Flexibilidade para categorização;;;;29;;;
Automotivo;2019;Novas tecnologias de motores sobrealimentados;Motores sobrealimentados;31 a 50% do mercado;31;50;51 a 70% do mercado;51;70;;0;0;;;;0;;0;;;;0;;0;;;Técnico de energias para o setor automotivo;Executar manutenção (reparar) em sistemas de recargas.;;Mecânica;;;Coordenação;;Compreensão escrita;;;;29;;;
Automotivo;2019;Novas tecnologias de conectividades. (rede can, big data, infotainment, etc.);Conectividade avançada;31 a 50% do mercado;31;50;51 a 70% do mercado;51;70;;0;0;;;;0;;0;;;;0;;0;;;Técnico de energias para o setor automotivo;Configurar sistemas smart grids;;Legislação e Governo;;;Orientação a serviços;;Destreza manual;;;;29;;;
Automotivo;2019;Iluminação led;Iluminação LED;51 a 70% do mercado;51;70;51 a 70% do mercado;51;70;;0;0;;;;0;;0;;;;0;;0;;;Técnico de energias para o setor automotivo;Analisar funcionameto dos sistema (presctivo).;;Produção e Processamento;;;Resolução de problemas complexos;;Coordenação corporal;;;;29;;;
Automotivo;2019;Novos sistemas de segurança (ex: Detector de fadiga, detector de pedestres, controle de aproximação).;Segurança avançada;31 a 50% do mercado;31;50;51 a 70% do mercado;51;70;;0;0;;;;0;;0;;;;0;;0;;;Técnico de energias para o setor automotivo;Diagnosticar falhas em sistemas de geração de energias;;Matemática;;;Manutenção de equipamentos;;Visão de perto;;;;29;;;
Automotivo;2019;Motores controlados eletronicamente, dispensando comandos de válvulas mecânicos;Motores eletrônicos;Até 10% do mercado;0;10;11 a 30% do mercado;11;30;;0;0;;;;0;;0;;;;0;;0;;;Técnico de energias para o setor automotivo;Executar manutenção (reparar) em sistemas de geração de energias;;Serviços;;;Seleção de equipamentos;;Raciocínio dedutivo;;;;29;;;
Automotivo;2019;Veículos híbridos / elétrico;Veículos híbridos/elétricos;31 a 50% do mercado;31;50;51 a 70% do mercado;51;70;;0;0;;;;0;;0;;;;0;;0;;;Técnico de energias para o setor automotivo;Executar projetos elétricos;;Telecomunicações;;;Instalação;;;;;;29;;;
Automotivo;2023;;;;0;0;;0;0;;0;0;;;;;;;;;;;;;;;Técnico em manutenção automotiva;;;;;;Julgamento e tomada de decisões;;;;;;29;;;
Celulose e Papel;2021;Crescimento do uso de matérias-primas à base de plantas para embalagens recicláveis;Matérias-primas vegetais;Até 10% do mercado;0;10;Até 10% do mercado;0;10;;0;0;;;;;;;;;;;;;;;Auxiliar de Fabricação de Fibra Celulósica;;;;;;Solução de problemas;;;;;;17;;;
Confecção de Vestuário;2021;Uso da Internet Industrial das Coisas para controle da produção;Internet industrial;Até 10% do mercado;0;10;11 a 30% do mercado;11;30;;0;0;;;;;;;;;;;;;;;Tecnólogo em Produção do Vestuário;Pesquisar novas tecnologias para modernização e diversificação de processos;;Produção e Processamento;;;Aprendizagem estratégica;;Controle de tempo de resposta;;;;14;;;
Confecção de Vestuário;2021;Uso de sistema Big Data para o planejamento da produção;Big data;11 a 30% do mercado;11;30;31 a 50% do mercado;31;50;;0;0;;;;;;;;;;;;;;;Tecnólogo em Produção do Vestuário;Analizar base com grandes volumes de dados, por meio da utilização de sistemas de big data;;Engenharia e Tecnologias;;;Comunicação;;Controle e precisão;;;;14;;;
Confecção de Vestuário;2021;Uso de visão artificial nas etapas do processo produtivo;Visão artificial;Até 10% do mercado;0;10;Até 10% do mercado;0;10;;0;0;;;;;;;;;;;;;;;Tecnólogo em Produção do Vestuário;Monitorar indicadores em processos automatizados;;Meio ambiente;;;Supervisão;;Velocidade perceptiva;;;;14;;;
Confecção de Vestuário;2021;Fornecimento de roupas “inteligentes” (smart clothing) e funcionais;Roupas inteligentes;Até 10% do mercado;0;10;11 a 30% do mercado;11;30;;0;0;;;;;;;;;;;;;;;Tecnólogo em Produção do Vestuário;Implementar processos de produção sustentáveis;;Psicologia;;;;;Raciocínio dedutivo;;;;14;;;
Confecção de Vestuário;2021;Uso de tecnologias de reciclagem e economia circular;Reciclagem circular;11 a 30% do mercado;11;30;31 a 50% do mercado;31;50;;0;0;;;;;;;;;;;;;;;Tecnólogo em Produção do Vestuário;Elaborar, junto com a equipe de manutenção, o planejamento de paradas das máquinas e equipamentos automatizados;;;;;;;;;;;14;;;
Confecção de Vestuário;2021;Uso de sistemas inteligentes de armazenamento e transporte;Armazenamento inteligente;11 a 30% do mercado;11;30;31 a 50% do mercado;31;50;;0;0;;;;;;;;;;;;;;;Designer de Moda;Atuar na interação com as diversas áreas da empresa para desenvolvimento de produto;;Administração e Gestão;;;Aprendizagem estratégica;;Atenção seletiva;;;;14;;;
Confecção de Vestuário;2021;Uso de sistemas 3D na área de desenvolvimento de produtos, integrados com a área de corte da empresa;Desenvolvimento 3D;Até 10% do mercado;0;10;11 a 30% do mercado;11;30;;0;0;;;;;;;;;;;;;;;Designer de Moda;Operar tecnologias de criação virtuais e digitais;;Produção e Processamento;;;Ciências;;Criatividade/originalidade;;;;14;;;
Confecção de Vestuário;2021;Uso de máquinas destinadas a costurar, cortar e modelar peças de vestuário de alta costura em uma única etapa;Máquinas multifuncionais;Até 10% do mercado;0;10;Até 10% do mercado;0;10;;0;0;;;;;;;;;;;;;;;Designer de Moda;Realizar planejamento de coleções considerando os ciclo de vida dos novos produtos.;;Comunicações e Mídia;;;Compreensão de leitura;;Discriminação de cores;;;;14;;;
Confecção de Vestuário;2021;Uso de tecnologia de realidade aumentada;Realidade aumentada;Até 10% do mercado;0;10;11 a 30% do mercado;11;30;;0;0;;;;;;;;;;;;;;;Designer de Moda;Desenvolver produtos sob a ótica da sustentabilidade ambiental e econômica.;;Sociologia e antropologia;;;Comunicação;;Expressão oral;;;;14;;;
